1761307134.181200 ens4  In  IP 10.254.240.1.34342 > atnog-brokers-001.europe-southwest1-b.c.route25ic-p-904873.internal.1883: Flags [P.], seq 1299625150:1299627966, ack 2975464736, win 502, options [nop,nop,TS val 111231672 ecr 27728877], length 2816
1761307134.181201 ens4  In  IP 10.254.240.1.34342 > atnog-brokers-001.europe-southwest1-b.c.route25ic-p-904873.internal.1883: Flags [P.], seq 2816:4596, ack 1, win 502, options [nop,nop,TS val 111231672 ecr 27728877], length 1780
1761307134.181201 ens4  In  IP 10.254.240.1.34342 > atnog-brokers-001.europe-southwest1-b.c.route25ic-p-904873.internal.1883: Flags [P.], seq 4596:7412, ack 1, win 502, options [nop,nop,TS val 111231772 ecr 27728877], length 2816
1761307134.181201 ens4  In  IP 10.254.240.1.34342 > atnog-brokers-001.europe-southwest1-b.c.route25ic-p-904873.internal.1883: Flags [P.], seq 7412:8835, ack 1, win 502, options [nop,nop,TS val 111231772 ecr 27728877], length 1423
1761307134.181307 ens4  Out IP atnog-brokers-001.europe-southwest1-b.c.route25ic-p-904873.internal.1883 > 10.254.240.1.34342: Flags [.], ack 2816, win 18977, options [nop,nop,TS val 27729279 ecr 111231672], length 0
1761307134.181342 ens4  Out IP atnog-brokers-001.europe-southwest1-b.c.route25ic-p-904873.internal.1883 > 10.254.240.1.34342: Flags [.], ack 8835, win 18930, options [nop,nop,TS val 27729279 ecr 111231672], length 0
1761307134.382699 ens4  In  IP 10.254.240.1.34342 > atnog-brokers-001.europe-southwest1-b.c.route25ic-p-904873.internal.1883: Flags [P.], seq 8835:11651, ack 1, win 502, options [nop,nop,TS val 111231873 ecr 27729078], length 2816
1761307134.382699 ens4  In  IP 10.254.240.1.34342 > atnog-brokers-001.europe-southwest1-b.c.route25ic-p-904873.internal.1883: Flags [P.], seq 11651:13074, ack 1, win 502, options [nop,nop,TS val 111231873 ecr 27729078], length 1423
1761307134.382699 ens4  In  IP 10.254.240.1.34342 > atnog-brokers-001.europe-southwest1-b.c.route25ic-p-904873.internal.1883: Flags [P.], seq 13074:15890, ack 1, win 502, options [nop,nop,TS val 111231973 ecr 27729078], length 2816
1761307134.382699 ens4  In  IP 10.254.240.1.34342 > atnog-brokers-001.europe-southwest1-b.c.route25ic-p-904873.internal.1883: Flags [P.], seq 15890:17313, ack 1, win 502, options [nop,nop,TS val 111231973 ecr 27729078], length 1423
1761307134.382699 ens4  In  IP 10.254.240.1.34342 > atnog-brokers-001.europe-southwest1-b.c.route25ic-p-904873.internal.1883: Flags [P.], seq 17313:20129, ack 1, win 502, options [nop,nop,TS val 111232073 ecr 27729279], length 2816
1761307134.382699 ens4  In  IP 10.254.240.1.34342 > atnog-brokers-001.europe-southwest1-b.c.route25ic-p-904873.internal.1883: Flags [P.], seq 20129:21195, ack 1, win 502, options [nop,nop,TS val 111232073 ecr 27729279], length 1066
1761307134.382773 ens4  Out IP atnog-brokers-001.europe-southwest1-b.c.route25ic-p-904873.internal.1883 > 10.254.240.1.34342: Flags [.], ack 11651, win 18977, options [nop,nop,TS val 27729480 ecr 111231873], length 0
1761307134.382826 ens4  Out IP atnog-brokers-001.europe-southwest1-b.c.route25ic-p-904873.internal.1883 > 10.254.240.1.34342: Flags [.], ack 21195, win 18903, options [nop,nop,TS val 27729480 ecr 111231873], length 0
1761307134.583519 ens4  In  IP 10.254.240.1.34342 > atnog-brokers-001.europe-southwest1-b.c.route25ic-p-904873.internal.1883: Flags [P.], seq 21195:24011, ack 1, win 502, options [nop,nop,TS val 111232173 ecr 27729279], length 2816
1761307134.583519 ens4  In  IP 10.254.240.1.34342 > atnog-brokers-001.europe-southwest1-b.c.route25ic-p-904873.internal.1883: Flags [P.], seq 24011:25077, ack 1, win 502, options [nop,nop,TS val 111232173 ecr 27729279], length 1066
1761307134.583562 ens4  Out IP atnog-brokers-001.europe-southwest1-b.c.route25ic-p-904873.internal.1883 > 10.254.240.1.34342: Flags [.], ack 24011, win 18975, options [nop,nop,TS val 27729681 ecr 111232173], length 0
1761307134.624197 ens4  Out IP atnog-brokers-001.europe-southwest1-b.c.route25ic-p-904873.internal.1883 > 10.254.240.1.34342: Flags [.], ack 25077, win 18996, options [nop,nop,TS val 27729722 ecr 111232173], length 0
1761307134.784575 ens4  In  IP 10.254.240.1.34342 > atnog-brokers-001.europe-southwest1-b.c.route25ic-p-904873.internal.1883: Flags [P.], seq 25077:27893, ack 1, win 502, options [nop,nop,TS val 111232273 ecr 27729480], length 2816
1761307134.784575 ens4  In  IP 10.254.240.1.34342 > atnog-brokers-001.europe-southwest1-b.c.route25ic-p-904873.internal.1883: Flags [P.], seq 27893:28959, ack 1, win 502, options [nop,nop,TS val 111232273 ecr 27729480], length 1066
1761307134.784575 ens4  In  IP 10.254.240.1.34342 > atnog-brokers-001.europe-southwest1-b.c.route25ic-p-904873.internal.1883: Flags [P.], seq 28959:31775, ack 1, win 502, options [nop,nop,TS val 111232373 ecr 27729480], length 2816
1761307134.784575 ens4  In  IP 10.254.240.1.34342 > atnog-brokers-001.europe-southwest1-b.c.route25ic-p-904873.internal.1883: Flags [P.], seq 31775:32841, ack 1, win 502, options [nop,nop,TS val 111232373 ecr 27729480], length 1066
1761307134.784736 ens4  Out IP atnog-brokers-001.europe-southwest1-b.c.route25ic-p-904873.internal.1883 > 10.254.240.1.34342: Flags [.], ack 32841, win 18936, options [nop,nop,TS val 27729882 ecr 111232273], length 0
1761307134.985517 ens4  In  IP 10.254.240.1.34342 > atnog-brokers-001.europe-southwest1-b.c.route25ic-p-904873.internal.1883: Flags [P.], seq 32841:35657, ack 1, win 502, options [nop,nop,TS val 111232474 ecr 27729722], length 2816
1761307134.985517 ens4  In  IP 10.254.240.1.34342 > atnog-brokers-001.europe-southwest1-b.c.route25ic-p-904873.internal.1883: Flags [P.], seq 35657:36366, ack 1, win 502, options [nop,nop,TS val 111232474 ecr 27729722], length 709
1761307134.985517 ens4  In  IP 10.254.240.1.34342 > atnog-brokers-001.europe-southwest1-b.c.route25ic-p-904873.internal.1883: Flags [P.], seq 36366:39182, ack 1, win 502, options [nop,nop,TS val 111232574 ecr 27729722], length 2816
1761307134.985517 ens4  In  IP 10.254.240.1.34342 > atnog-brokers-001.europe-southwest1-b.c.route25ic-p-904873.internal.1883: Flags [P.], seq 39182:39891, ack 1, win 502, options [nop,nop,TS val 111232574 ecr 27729722], length 709
1761307134.985593 ens4  Out IP atnog-brokers-001.europe-southwest1-b.c.route25ic-p-904873.internal.1883 > 10.254.240.1.34342: Flags [.], ack 35657, win 18977, options [nop,nop,TS val 27730083 ecr 111232474], length 0
1761307134.985655 ens4  Out IP atnog-brokers-001.europe-southwest1-b.c.route25ic-p-904873.internal.1883 > 10.254.240.1.34342: Flags [.], ack 39891, win 18944, options [nop,nop,TS val 27730083 ecr 111232474], length 0
1761307135.186419 ens4  In  IP 10.254.240.1.34342 > atnog-brokers-001.europe-southwest1-b.c.route25ic-p-904873.internal.1883: Flags [P.], seq 39891:42707, ack 1, win 502, options [nop,nop,TS val 111232674 ecr 27729882], length 2816
1761307135.186419 ens4  In  IP 10.254.240.1.34342 > atnog-brokers-001.europe-southwest1-b.c.route25ic-p-904873.internal.1883: Flags [P.], seq 42707:43416, ack 1, win 502, options [nop,nop,TS val 111232674 ecr 27729882], length 709
1761307135.186419 ens4  In  IP 10.254.240.1.34342 > atnog-brokers-001.europe-southwest1-b.c.route25ic-p-904873.internal.1883: Flags [P.], seq 43416:46232, ack 1, win 502, options [nop,nop,TS val 111232774 ecr 27729882], length 2816
1761307135.186419 ens4  In  IP 10.254.240.1.34342 > atnog-brokers-001.europe-southwest1-b.c.route25ic-p-904873.internal.1883: Flags [P.], seq 46232:46584, ack 1, win 502, options [nop,nop,TS val 111232774 ecr 27729882], length 352
1761307135.186419 ens4  In  IP 10.254.240.1.34342 > atnog-brokers-001.europe-southwest1-b.c.route25ic-p-904873.internal.1883: Flags [.], seq 46584:47992, ack 1, win 502, options [nop,nop,TS val 111232874 ecr 27730083], length 1408
1761307135.186496 ens4  Out IP atnog-brokers-001.europe-southwest1-b.c.route25ic-p-904873.internal.1883 > 10.254.240.1.34342: Flags [.], ack 42707, win 18975, options [nop,nop,TS val 27730284 ecr 111232674], length 0
1761307135.186556 ens4  Out IP atnog-brokers-001.europe-southwest1-b.c.route25ic-p-904873.internal.1883 > 10.254.240.1.34342: Flags [.], ack 47992, win 18934, options [nop,nop,TS val 27730284 ecr 111232674], length 0
1761307135.387813 ens4  In  IP 10.254.240.1.34342 > atnog-brokers-001.europe-southwest1-b.c.route25ic-p-904873.internal.1883: Flags [P.], seq 47992:49400, ack 1, win 502, options [nop,nop,TS val 111232874 ecr 27730083], length 1408
1761307135.387813 ens4  In  IP 10.254.240.1.34342 > atnog-brokers-001.europe-southwest1-b.c.route25ic-p-904873.internal.1883: Flags [P.], seq 49400:49752, ack 1, win 502, options [nop,nop,TS val 111232874 ecr 27730083], length 352
1761307135.387813 ens4  In  IP 10.254.240.1.34342 > atnog-brokers-001.europe-southwest1-b.c.route25ic-p-904873.internal.1883: Flags [P.], seq 49752:52568, ack 1, win 502, options [nop,nop,TS val 111232974 ecr 27730083], length 2816
1761307135.387813 ens4  In  IP 10.254.240.1.34342 > atnog-brokers-001.europe-southwest1-b.c.route25ic-p-904873.internal.1883: Flags [P.], seq 52568:52920, ack 1, win 502, options [nop,nop,TS val 111232974 ecr 27730083], length 352
1761307135.387902 ens4  Out IP atnog-brokers-001.europe-southwest1-b.c.route25ic-p-904873.internal.1883 > 10.254.240.1.34342: Flags [.], ack 49752, win 18994, options [nop,nop,TS val 27730485 ecr 111232874], length 0
1761307135.388004 ens4  Out IP atnog-brokers-001.europe-southwest1-b.c.route25ic-p-904873.internal.1883 > 10.254.240.1.34342: Flags [.], ack 52920, win 18970, options [nop,nop,TS val 27730485 ecr 111232974], length 0
1761307135.588185 ens4  In  IP 10.254.240.1.34342 > atnog-brokers-001.europe-southwest1-b.c.route25ic-p-904873.internal.1883: Flags [P.], seq 52920:55731, ack 1, win 502, options [nop,nop,TS val 111233074 ecr 27730284], length 2811
1761307135.588185 ens4  In  IP 10.254.240.1.34342 > atnog-brokers-001.europe-southwest1-b.c.route25ic-p-904873.internal.1883: Flags [P.], seq 55731:58542, ack 1, win 502, options [nop,nop,TS val 111233175 ecr 27730284], length 2811
1761307135.588232 ens4  Out IP atnog-brokers-001.europe-southwest1-b.c.route25ic-p-904873.internal.1883 > 10.254.240.1.34342: Flags [.], ack 55731, win 18977, options [nop,nop,TS val 27730686 ecr 111233074], length 0
1761307135.588273 ens4  Out IP atnog-brokers-001.europe-southwest1-b.c.route25ic-p-904873.internal.1883 > 10.254.240.1.34342: Flags [.], ack 58542, win 18956, options [nop,nop,TS val 27730686 ecr 111233175], length 0
1761307135.789968 ens4  In  IP 10.254.240.1.34342 > atnog-brokers-001.europe-southwest1-b.c.route25ic-p-904873.internal.1883: Flags [P.], seq 58542:61353, ack 1, win 502, options [nop,nop,TS val 111233275 ecr 27730485], length 2811
1761307135.789969 ens4  In  IP 10.254.240.1.34342 > atnog-brokers-001.europe-southwest1-b.c.route25ic-p-904873.internal.1883: Flags [P.], seq 61353:63807, ack 1, win 502, options [nop,nop,TS val 111233375 ecr 27730485], length 2454
1761307135.790047 ens4  Out IP atnog-brokers-001.europe-southwest1-b.c.route25ic-p-904873.internal.1883 > 10.254.240.1.34342: Flags [.], ack 61353, win 18977, options [nop,nop,TS val 27730887 ecr 111233275], length 0
1761307135.790144 ens4  Out IP atnog-brokers-001.europe-southwest1-b.c.route25ic-p-904873.internal.1883 > 10.254.240.1.34342: Flags [.], ack 63807, win 18958, options [nop,nop,TS val 27730888 ecr 111233375], length 0
1761307135.990216 ens4  In  IP 10.254.240.1.34342 > atnog-brokers-001.europe-southwest1-b.c.route25ic-p-904873.internal.1883: Flags [P.], seq 63807:66261, ack 1, win 502, options [nop,nop,TS val 111233475 ecr 27730686], length 2454
1761307135.990217 ens4  In  IP 10.254.240.1.34342 > atnog-brokers-001.europe-southwest1-b.c.route25ic-p-904873.internal.1883: Flags [P.], seq 66261:68715, ack 1, win 502, options [nop,nop,TS val 111233575 ecr 27730686], length 2454
1761307135.990217 ens4  In  IP 10.254.240.1.34342 > atnog-brokers-001.europe-southwest1-b.c.route25ic-p-904873.internal.1883: Flags [P.], seq 68715:70812, ack 1, win 502, options [nop,nop,TS val 111233675 ecr 27730888], length 2097
1761307135.990298 ens4  Out IP atnog-brokers-001.europe-southwest1-b.c.route25ic-p-904873.internal.1883 > 10.254.240.1.34342: Flags [.], ack 66261, win 18977, options [nop,nop,TS val 27731088 ecr 111233475], length 0
1761307135.990381 ens4  Out IP atnog-brokers-001.europe-southwest1-b.c.route25ic-p-904873.internal.1883 > 10.254.240.1.34342: Flags [.], ack 70812, win 18943, options [nop,nop,TS val 27731088 ecr 111233575], length 0
1761307136.191443 ens4  In  IP 10.254.240.1.34342 > atnog-brokers-001.europe-southwest1-b.c.route25ic-p-904873.internal.1883: Flags [P.], seq 70812:72909, ack 1, win 502, options [nop,nop,TS val 111233775 ecr 27730888], length 2097
1761307136.191514 ens4  Out IP atnog-brokers-001.europe-southwest1-b.c.route25ic-p-904873.internal.1883 > 10.254.240.1.34342: Flags [.], ack 72909, win 18989, options [nop,nop,TS val 27731289 ecr 111233775], length 0
1761307136.393183 ens4  In  IP 10.254.240.1.34342 > atnog-brokers-001.europe-southwest1-b.c.route25ic-p-904873.internal.1883: Flags [P.], seq 72909:75006, ack 1, win 502, options [nop,nop,TS val 111233876 ecr 27731088], length 2097
1761307136.393183 ens4  In  IP 10.254.240.1.34342 > atnog-brokers-001.europe-southwest1-b.c.route25ic-p-904873.internal.1883: Flags [P.], seq 75006:76746, ack 1, win 502, options [nop,nop,TS val 111233976 ecr 27731088], length 1740
1761307136.393254 ens4  Out IP atnog-brokers-001.europe-southwest1-b.c.route25ic-p-904873.internal.1883 > 10.254.240.1.34342: Flags [.], ack 75006, win 18989, options [nop,nop,TS val 27731491 ecr 111233876], length 0
1761307136.393299 ens4  Out IP atnog-brokers-001.europe-southwest1-b.c.route25ic-p-904873.internal.1883 > 10.254.240.1.34342: Flags [.], ack 76746, win 18977, options [nop,nop,TS val 27731491 ecr 111233976], length 0
1761307136.593815 ens4  In  IP 10.254.240.1.34342 > atnog-brokers-001.europe-southwest1-b.c.route25ic-p-904873.internal.1883: Flags [P.], seq 76746:78486, ack 1, win 502, options [nop,nop,TS val 111234076 ecr 27731289], length 1740
1761307136.593816 ens4  In  IP 10.254.240.1.34342 > atnog-brokers-001.europe-southwest1-b.c.route25ic-p-904873.internal.1883: Flags [P.], seq 78486:80226, ack 1, win 502, options [nop,nop,TS val 111234176 ecr 27731289], length 1740
1761307136.593950 ens4  Out IP atnog-brokers-001.europe-southwest1-b.c.route25ic-p-904873.internal.1883 > 10.254.240.1.34342: Flags [.], ack 78486, win 18993, options [nop,nop,TS val 27731691 ecr 111234076], length 0
1761307136.593985 ens4  Out IP atnog-brokers-001.europe-southwest1-b.c.route25ic-p-904873.internal.1883 > 10.254.240.1.34342: Flags [.], ack 80226, win 18981, options [nop,nop,TS val 27731691 ecr 111234176], length 0
1761307136.971707 ens4  In  IP 10.254.240.1.34342 > atnog-brokers-001.europe-southwest1-b.c.route25ic-p-904873.internal.1883: Flags [P.], seq 80226:83042, ack 1, win 502, options [nop,nop,TS val 111234577 ecr 27731691], length 2816
1761307136.971708 ens4  In  IP 10.254.240.1.34342 > atnog-brokers-001.europe-southwest1-b.c.route25ic-p-904873.internal.1883: Flags [P.], seq 83042:85171, ack 1, win 502, options [nop,nop,TS val 111234577 ecr 27731691], length 2129
1761307136.971859 ens4  Out IP atnog-brokers-001.europe-southwest1-b.c.route25ic-p-904873.internal.1883 > 10.254.240.1.34342: Flags [.], ack 85171, win 18965, options [nop,nop,TS val 27732069 ecr 111234577], length 0
1761307137.172030 ens4  In  IP 10.254.240.1.34342 > atnog-brokers-001.europe-southwest1-b.c.route25ic-p-904873.internal.1883: Flags [P.], seq 85171:87987, ack 1, win 502, options [nop,nop,TS val 111234677 ecr 27731691], length 2816
1761307137.172030 ens4  In  IP 10.254.240.1.34342 > atnog-brokers-001.europe-southwest1-b.c.route25ic-p-904873.internal.1883: Flags [P.], seq 87987:90116, ack 1, win 502, options [nop,nop,TS val 111234677 ecr 27731691], length 2129
1761307137.172109 ens4  Out IP atnog-brokers-001.europe-southwest1-b.c.route25ic-p-904873.internal.1883 > 10.254.240.1.34342: Flags [.], ack 87987, win 18977, options [nop,nop,TS val 27732269 ecr 111234677], length 0
1761307137.172170 ens4  Out IP atnog-brokers-001.europe-southwest1-b.c.route25ic-p-904873.internal.1883 > 10.254.240.1.34342: Flags [.], ack 90116, win 18965, options [nop,nop,TS val 27732270 ecr 111234677], length 0
1761307137.373510 ens4  In  IP 10.254.240.1.34342 > atnog-brokers-001.europe-southwest1-b.c.route25ic-p-904873.internal.1883: Flags [P.], seq 90116:92932, ack 1, win 502, options [nop,nop,TS val 111234777 ecr 27731691], length 2816
1761307137.373581 ens4  Out IP atnog-brokers-001.europe-southwest1-b.c.route25ic-p-904873.internal.1883 > 10.254.240.1.34342: Flags [.], ack 92932, win 18977, options [nop,nop,TS val 27732471 ecr 111234777], length 0
1761307137.373591 ens4  In  IP 10.254.240.1.34342 > atnog-brokers-001.europe-southwest1-b.c.route25ic-p-904873.internal.1883: Flags [P.], seq 92932:95061, ack 1, win 502, options [nop,nop,TS val 111234777 ecr 27731691], length 2129
1761307137.373591 ens4  In  IP 10.254.240.1.34342 > atnog-brokers-001.europe-southwest1-b.c.route25ic-p-904873.internal.1883: Flags [P.], seq 95061:97877, ack 1, win 502, options [nop,nop,TS val 111234877 ecr 27732069], length 2816
1761307137.373591 ens4  In  IP 10.254.240.1.34342 > atnog-brokers-001.europe-southwest1-b.c.route25ic-p-904873.internal.1883: Flags [P.], seq 97877:100007, ack 1, win 502, options [nop,nop,TS val 111234877 ecr 27732069], length 2130
1761307137.373668 ens4  Out IP atnog-brokers-001.europe-southwest1-b.c.route25ic-p-904873.internal.1883 > 10.254.240.1.34342: Flags [.], ack 100007, win 18922, options [nop,nop,TS val 27732471 ecr 111234777], length 0
1761307137.574490 ens4  In  IP 10.254.240.1.34342 > atnog-brokers-001.europe-southwest1-b.c.route25ic-p-904873.internal.1883: Flags [P.], seq 100007:102823, ack 1, win 502, options [nop,nop,TS val 111234977 ecr 27732069], length 2816
1761307137.574490 ens4  In  IP 10.254.240.1.34342 > atnog-brokers-001.europe-southwest1-b.c.route25ic-p-904873.internal.1883: Flags [P.], seq 102823:104953, ack 1, win 502, options [nop,nop,TS val 111234977 ecr 27732069], length 2130
1761307137.574556 ens4  Out IP atnog-brokers-001.europe-southwest1-b.c.route25ic-p-904873.internal.1883 > 10.254.240.1.34342: Flags [.], ack 102823, win 18977, options [nop,nop,TS val 27732672 ecr 111234977], length 0
1761307137.574579 ens4  In  IP 10.254.240.1.34342 > atnog-brokers-001.europe-southwest1-b.c.route25ic-p-904873.internal.1883: Flags [P.], seq 104953:107769, ack 1, win 502, options [nop,nop,TS val 111235077 ecr 27732270], length 2816
1761307137.574579 ens4  In  IP 10.254.240.1.34342 > atnog-brokers-001.europe-southwest1-b.c.route25ic-p-904873.internal.1883: Flags [P.], seq 107769:109898, ack 1, win 502, options [nop,nop,TS val 111235077 ecr 27732270], length 2129
1761307137.574579 ens4  In  IP 10.254.240.1.34342 > atnog-brokers-001.europe-southwest1-b.c.route25ic-p-904873.internal.1883: Flags [P.], seq 109898:112714, ack 1, win 502, options [nop,nop,TS val 111235178 ecr 27732270], length 2816
1761307137.574579 ens4  In  IP 10.254.240.1.34342 > atnog-brokers-001.europe-southwest1-b.c.route25ic-p-904873.internal.1883: Flags [P.], seq 112714:114843, ack 1, win 502, options [nop,nop,TS val 111235178 ecr 27732270], length 2129
1761307137.574579 ens4  In  IP 10.254.240.1.34342 > atnog-brokers-001.europe-southwest1-b.c.route25ic-p-904873.internal.1883: Flags [P.], seq 114843:117659, ack 1, win 502, options [nop,nop,TS val 111235278 ecr 27732471], length 2816
1761307137.574579 ens4  In  IP 10.254.240.1.34342 > atnog-brokers-001.europe-southwest1-b.c.route25ic-p-904873.internal.1883: Flags [P.], seq 117659:119789, ack 1, win 502, options [nop,nop,TS val 111235278 ecr 27732471], length 2130
1761307137.574594 ens4  Out IP atnog-brokers-001.europe-southwest1-b.c.route25ic-p-904873.internal.1883 > 10.254.240.1.34342: Flags [.], ack 104953, win 18965, options [nop,nop,TS val 27732672 ecr 111234977], length 0
1761307137.574612 ens4  Out IP atnog-brokers-001.europe-southwest1-b.c.route25ic-p-904873.internal.1883 > 10.254.240.1.34342: Flags [.], ack 119789, win 18858, options [nop,nop,TS val 27732672 ecr 111235077], length 0
1761307137.775553 ens4  In  IP 10.254.240.1.34342 > atnog-brokers-001.europe-southwest1-b.c.route25ic-p-904873.internal.1883: Flags [P.], seq 119789:122605, ack 1, win 502, options [nop,nop,TS val 111235378 ecr 27732471], length 2816
1761307137.775554 ens4  In  IP 10.254.240.1.34342 > atnog-brokers-001.europe-southwest1-b.c.route25ic-p-904873.internal.1883: Flags [P.], seq 122605:124733, ack 1, win 502, options [nop,nop,TS val 111235378 ecr 27732471], length 2128
1761307137.775625 ens4  Out IP atnog-brokers-001.europe-southwest1-b.c.route25ic-p-904873.internal.1883 > 10.254.240.1.34342: Flags [.], ack 122605, win 18977, options [nop,nop,TS val 27732873 ecr 111235378], length 0
1761307137.775663 ens4  Out IP atnog-brokers-001.europe-southwest1-b.c.route25ic-p-904873.internal.1883 > 10.254.240.1.34342: Flags [.], ack 124733, win 18965, options [nop,nop,TS val 27732873 ecr 111235378], length 0
1761307137.976576 ens4  In  IP 10.254.240.1.34342 > atnog-brokers-001.europe-southwest1-b.c.route25ic-p-904873.internal.1883: Flags [P.], seq 124733:127549, ack 1, win 502, options [nop,nop,TS val 111235478 ecr 27732672], length 2816
1761307137.976576 ens4  In  IP 10.254.240.1.34342 > atnog-brokers-001.europe-southwest1-b.c.route25ic-p-904873.internal.1883: Flags [P.], seq 127549:129677, ack 1, win 502, options [nop,nop,TS val 111235478 ecr 27732672], length 2128
1761307137.976576 ens4  In  IP 10.254.240.1.34342 > atnog-brokers-001.europe-southwest1-b.c.route25ic-p-904873.internal.1883: Flags [P.], seq 129677:132493, ack 1, win 502, options [nop,nop,TS val 111235578 ecr 27732672], length 2816
1761307137.976576 ens4  In  IP 10.254.240.1.34342 > atnog-brokers-001.europe-southwest1-b.c.route25ic-p-904873.internal.1883: Flags [P.], seq 132493:134623, ack 1, win 502, options [nop,nop,TS val 111235578 ecr 27732672], length 2130
1761307137.976650 ens4  Out IP atnog-brokers-001.europe-southwest1-b.c.route25ic-p-904873.internal.1883 > 10.254.240.1.34342: Flags [.], ack 127549, win 18978, options [nop,nop,TS val 27733074 ecr 111235478], length 0
1761307137.976692 ens4  Out IP atnog-brokers-001.europe-southwest1-b.c.route25ic-p-904873.internal.1883 > 10.254.240.1.34342: Flags [.], ack 134623, win 18933, options [nop,nop,TS val 27733074 ecr 111235478], length 0
1761307138.177334 ens4  In  IP 10.254.240.1.34342 > atnog-brokers-001.europe-southwest1-b.c.route25ic-p-904873.internal.1883: Flags [P.], seq 134623:137439, ack 1, win 502, options [nop,nop,TS val 111235678 ecr 27732873], length 2816
1761307138.177334 ens4  In  IP 10.254.240.1.34342 > atnog-brokers-001.europe-southwest1-b.c.route25ic-p-904873.internal.1883: Flags [P.], seq 137439:139568, ack 1, win 502, options [nop,nop,TS val 111235678 ecr 27732873], length 2129
1761307138.177335 ens4  In  IP 10.254.240.1.34342 > atnog-brokers-001.europe-southwest1-b.c.route25ic-p-904873.internal.1883: Flags [P.], seq 139568:142384, ack 1, win 502, options [nop,nop,TS val 111235778 ecr 27732873], length 2816
1761307138.177335 ens4  In  IP 10.254.240.1.34342 > atnog-brokers-001.europe-southwest1-b.c.route25ic-p-904873.internal.1883: Flags [P.], seq 142384:144513, ack 1, win 502, options [nop,nop,TS val 111235778 ecr 27732873], length 2129
1761307138.177407 ens4  Out IP atnog-brokers-001.europe-southwest1-b.c.route25ic-p-904873.internal.1883 > 10.254.240.1.34342: Flags [.], ack 137439, win 18985, options [nop,nop,TS val 27733275 ecr 111235678], length 0
1761307138.177466 ens4  Out IP atnog-brokers-001.europe-southwest1-b.c.route25ic-p-904873.internal.1883 > 10.254.240.1.34342: Flags [.], ack 144513, win 18940, options [nop,nop,TS val 27733275 ecr 111235678], length 0
1761307138.378523 ens4  In  IP 10.254.240.1.34342 > atnog-brokers-001.europe-southwest1-b.c.route25ic-p-904873.internal.1883: Flags [P.], seq 144513:147329, ack 1, win 502, options [nop,nop,TS val 111235879 ecr 27733074], length 2816
1761307138.378524 ens4  In  IP 10.254.240.1.34342 > atnog-brokers-001.europe-southwest1-b.c.route25ic-p-904873.internal.1883: Flags [P.], seq 147329:149459, ack 1, win 502, options [nop,nop,TS val 111235879 ecr 27733074], length 2130
1761307138.378524 ens4  In  IP 10.254.240.1.34342 > atnog-brokers-001.europe-southwest1-b.c.route25ic-p-904873.internal.1883: Flags [P.], seq 149459:152275, ack 1, win 502, options [nop,nop,TS val 111235979 ecr 27733074], length 2816
1761307138.378524 ens4  In  IP 10.254.240.1.34342 > atnog-brokers-001.europe-southwest1-b.c.route25ic-p-904873.internal.1883: Flags [P.], seq 152275:154404, ack 1, win 502, options [nop,nop,TS val 111235979 ecr 27733074], length 2129
1761307138.378602 ens4  Out IP atnog-brokers-001.europe-southwest1-b.c.route25ic-p-904873.internal.1883 > 10.254.240.1.34342: Flags [.], ack 147329, win 18978, options [nop,nop,TS val 27733476 ecr 111235879], length 0
1761307138.378655 ens4  Out IP atnog-brokers-001.europe-southwest1-b.c.route25ic-p-904873.internal.1883 > 10.254.240.1.34342: Flags [.], ack 154404, win 18933, options [nop,nop,TS val 27733476 ecr 111235879], length 0
1761307138.579309 ens4  In  IP 10.254.240.1.34342 > atnog-brokers-001.europe-southwest1-b.c.route25ic-p-904873.internal.1883: Flags [P.], seq 154404:157220, ack 1, win 502, options [nop,nop,TS val 111236079 ecr 27733275], length 2816
1761307138.579309 ens4  In  IP 10.254.240.1.34342 > atnog-brokers-001.europe-southwest1-b.c.route25ic-p-904873.internal.1883: Flags [P.], seq 157220:159349, ack 1, win 502, options [nop,nop,TS val 111236079 ecr 27733275], length 2129
1761307138.579309 ens4  In  IP 10.254.240.1.34342 > atnog-brokers-001.europe-southwest1-b.c.route25ic-p-904873.internal.1883: Flags [P.], seq 159349:162165, ack 1, win 502, options [nop,nop,TS val 111236179 ecr 27733275], length 2816
1761307138.579309 ens4  In  IP 10.254.240.1.34342 > atnog-brokers-001.europe-southwest1-b.c.route25ic-p-904873.internal.1883: Flags [P.], seq 162165:164295, ack 1, win 502, options [nop,nop,TS val 111236179 ecr 27733275], length 2130
1761307138.579378 ens4  Out IP atnog-brokers-001.europe-southwest1-b.c.route25ic-p-904873.internal.1883 > 10.254.240.1.34342: Flags [.], ack 157220, win 18978, options [nop,nop,TS val 27733677 ecr 111236079], length 0
1761307138.579417 ens4  Out IP atnog-brokers-001.europe-southwest1-b.c.route25ic-p-904873.internal.1883 > 10.254.240.1.34342: Flags [.], ack 164295, win 18937, options [nop,nop,TS val 27733677 ecr 111236079], length 0
1761307138.780596 ens4  In  IP 10.254.240.1.34342 > atnog-brokers-001.europe-southwest1-b.c.route25ic-p-904873.internal.1883: Flags [P.], seq 164295:167111, ack 1, win 502, options [nop,nop,TS val 111236279 ecr 27733476], length 2816
1761307138.780596 ens4  In  IP 10.254.240.1.34342 > atnog-brokers-001.europe-southwest1-b.c.route25ic-p-904873.internal.1883: Flags [P.], seq 167111:169240, ack 1, win 502, options [nop,nop,TS val 111236279 ecr 27733476], length 2129
1761307138.780596 ens4  In  IP 10.254.240.1.34342 > atnog-brokers-001.europe-southwest1-b.c.route25ic-p-904873.internal.1883: Flags [P.], seq 169240:172056, ack 1, win 502, options [nop,nop,TS val 111236379 ecr 27733476], length 2816
1761307138.780596 ens4  In  IP 10.254.240.1.34342 > atnog-brokers-001.europe-southwest1-b.c.route25ic-p-904873.internal.1883: Flags [P.], seq 172056:174185, ack 1, win 502, options [nop,nop,TS val 111236379 ecr 27733476], length 2129
1761307138.780673 ens4  Out IP atnog-brokers-001.europe-southwest1-b.c.route25ic-p-904873.internal.1883 > 10.254.240.1.34342: Flags [.], ack 167111, win 18978, options [nop,nop,TS val 27733878 ecr 111236279], length 0
1761307138.780732 ens4  Out IP atnog-brokers-001.europe-southwest1-b.c.route25ic-p-904873.internal.1883 > 10.254.240.1.34342: Flags [.], ack 174185, win 18923, options [nop,nop,TS val 27733878 ecr 111236279], length 0
1761307138.981754 ens4  In  IP 10.254.240.1.34342 > atnog-brokers-001.europe-southwest1-b.c.route25ic-p-904873.internal.1883: Flags [P.], seq 174185:177001, ack 1, win 502, options [nop,nop,TS val 111236479 ecr 27733677], length 2816
1761307138.981755 ens4  In  IP 10.254.240.1.34342 > atnog-brokers-001.europe-southwest1-b.c.route25ic-p-904873.internal.1883: Flags [P.], seq 177001:179130, ack 1, win 502, options [nop,nop,TS val 111236479 ecr 27733677], length 2129
1761307138.981755 ens4  In  IP 10.254.240.1.34342 > atnog-brokers-001.europe-southwest1-b.c.route25ic-p-904873.internal.1883: Flags [P.], seq 179130:181946, ack 1, win 502, options [nop,nop,TS val 111236580 ecr 27733677], length 2816
1761307138.981755 ens4  In  IP 10.254.240.1.34342 > atnog-brokers-001.europe-southwest1-b.c.route25ic-p-904873.internal.1883: Flags [P.], seq 181946:184074, ack 1, win 502, options [nop,nop,TS val 111236580 ecr 27733677], length 2128
1761307138.981826 ens4  Out IP atnog-brokers-001.europe-southwest1-b.c.route25ic-p-904873.internal.1883 > 10.254.240.1.34342: Flags [.], ack 177001, win 18979, options [nop,nop,TS val 27734079 ecr 111236479], length 0
1761307138.981883 ens4  Out IP atnog-brokers-001.europe-southwest1-b.c.route25ic-p-904873.internal.1883 > 10.254.240.1.34342: Flags [.], ack 184074, win 18924, options [nop,nop,TS val 27734079 ecr 111236479], length 0
1761307139.182748 ens4  In  IP 10.254.240.1.34342 > atnog-brokers-001.europe-southwest1-b.c.route25ic-p-904873.internal.1883: Flags [P.], seq 184074:186890, ack 1, win 502, options [nop,nop,TS val 111236680 ecr 27733878], length 2816
1761307139.182748 ens4  In  IP 10.254.240.1.34342 > atnog-brokers-001.europe-southwest1-b.c.route25ic-p-904873.internal.1883: Flags [P.], seq 186890:189019, ack 1, win 502, options [nop,nop,TS val 111236680 ecr 27733878], length 2129
1761307139.182748 ens4  In  IP 10.254.240.1.34342 > atnog-brokers-001.europe-southwest1-b.c.route25ic-p-904873.internal.1883: Flags [P.], seq 189019:191835, ack 1, win 502, options [nop,nop,TS val 111236780 ecr 27733878], length 2816
1761307139.182748 ens4  In  IP 10.254.240.1.34342 > atnog-brokers-001.europe-southwest1-b.c.route25ic-p-904873.internal.1883: Flags [P.], seq 191835:193964, ack 1, win 502, options [nop,nop,TS val 111236780 ecr 27733878], length 2129
1761307139.182822 ens4  Out IP atnog-brokers-001.europe-southwest1-b.c.route25ic-p-904873.internal.1883 > 10.254.240.1.34342: Flags [.], ack 186890, win 18979, options [nop,nop,TS val 27734280 ecr 111236680], length 0
1761307139.182873 ens4  Out IP atnog-brokers-001.europe-southwest1-b.c.route25ic-p-904873.internal.1883 > 10.254.240.1.34342: Flags [.], ack 193964, win 18924, options [nop,nop,TS val 27734280 ecr 111236680], length 0
1761307139.182935 ens4  In  IP 10.254.240.1.34342 > atnog-brokers-001.europe-southwest1-b.c.route25ic-p-904873.internal.1883: Flags [.], seq 193964:195372, ack 1, win 502, options [nop,nop,TS val 111236880 ecr 27734079], length 1408
1761307139.223204 ens4  Out IP atnog-brokers-001.europe-southwest1-b.c.route25ic-p-904873.internal.1883 > 10.254.240.1.34342: Flags [.], ack 195372, win 18996, options [nop,nop,TS val 27734321 ecr 111236880], length 0
1761307139.383717 ens4  In  IP 10.254.240.1.34342 > atnog-brokers-001.europe-southwest1-b.c.route25ic-p-904873.internal.1883: Flags [P.], seq 195372:196780, ack 1, win 502, options [nop,nop,TS val 111236880 ecr 27734079], length 1408
1761307139.383717 ens4  In  IP 10.254.240.1.34342 > atnog-brokers-001.europe-southwest1-b.c.route25ic-p-904873.internal.1883: Flags [P.], seq 196780:198908, ack 1, win 502, options [nop,nop,TS val 111236880 ecr 27734079], length 2128
1761307139.383717 ens4  In  IP 10.254.240.1.34342 > atnog-brokers-001.europe-southwest1-b.c.route25ic-p-904873.internal.1883: Flags [P.], seq 198908:201724, ack 1, win 502, options [nop,nop,TS val 111236980 ecr 27734079], length 2816
1761307139.383717 ens4  In  IP 10.254.240.1.34342 > atnog-brokers-001.europe-southwest1-b.c.route25ic-p-904873.internal.1883: Flags [P.], seq 201724:203853, ack 1, win 502, options [nop,nop,TS val 111236980 ecr 27734079], length 2129
1761307139.383717 ens4  In  IP 10.254.240.1.34342 > atnog-brokers-001.europe-southwest1-b.c.route25ic-p-904873.internal.1883: Flags [P.], seq 203853:206669, ack 1, win 502, options [nop,nop,TS val 111237080 ecr 27734321], length 2816
1761307139.383717 ens4  In  IP 10.254.240.1.34342 > atnog-brokers-001.europe-southwest1-b.c.route25ic-p-904873.internal.1883: Flags [P.], seq 206669:208799, ack 1, win 502, options [nop,nop,TS val 111237080 ecr 27734321], length 2130
1761307139.383810 ens4  In  IP 10.254.240.1.34342 > atnog-brokers-001.europe-southwest1-b.c.route25ic-p-904873.internal.1883: Flags [.], seq 208799:210207, ack 1, win 502, options [nop,nop,TS val 111237181 ecr 27734321], length 1408
1761307139.383848 ens4  Out IP atnog-brokers-001.europe-southwest1-b.c.route25ic-p-904873.internal.1883 > 10.254.240.1.34342: Flags [.], ack 210207, win 18881, options [nop,nop,TS val 27734481 ecr 111236880], length 0
1761307139.584138 ens4  In  IP 10.254.240.1.34342 > atnog-brokers-001.europe-southwest1-b.c.route25ic-p-904873.internal.1883: Flags [P.], seq 210207:211615, ack 1, win 502, options [nop,nop,TS val 111237181 ecr 27734321], length 1408
1761307139.584219 ens4  In  IP 10.254.240.1.34342 > atnog-brokers-001.europe-southwest1-b.c.route25ic-p-904873.internal.1883: Flags [P.], seq 211615:213745, ack 1, win 502, options [nop,nop,TS val 111237181 ecr 27734321], length 2130
1761307139.584239 ens4  Out IP atnog-brokers-001.europe-southwest1-b.c.route25ic-p-904873.internal.1883 > 10.254.240.1.34342: Flags [.], ack 213745, win 18976, options [nop,nop,TS val 27734682 ecr 111237181], length 0
1761307139.785392 ens4  In  IP 10.254.240.1.34342 > atnog-brokers-001.europe-southwest1-b.c.route25ic-p-904873.internal.1883: Flags [P.], seq 213745:216561, ack 1, win 502, options [nop,nop,TS val 111237281 ecr 27734481], length 2816
1761307139.785392 ens4  In  IP 10.254.240.1.34342 > atnog-brokers-001.europe-southwest1-b.c.route25ic-p-904873.internal.1883: Flags [P.], seq 216561:218689, ack 1, win 502, options [nop,nop,TS val 111237281 ecr 27734481], length 2128
1761307139.785392 ens4  In  IP 10.254.240.1.34342 > atnog-brokers-001.europe-southwest1-b.c.route25ic-p-904873.internal.1883: Flags [P.], seq 218689:221505, ack 1, win 502, options [nop,nop,TS val 111237381 ecr 27734481], length 2816
1761307139.785392 ens4  In  IP 10.254.240.1.34342 > atnog-brokers-001.europe-southwest1-b.c.route25ic-p-904873.internal.1883: Flags [P.], seq 221505:223635, ack 1, win 502, options [nop,nop,TS val 111237381 ecr 27734481], length 2130
1761307139.785460 ens4  Out IP atnog-brokers-001.europe-southwest1-b.c.route25ic-p-904873.internal.1883 > 10.254.240.1.34342: Flags [.], ack 216561, win 18981, options [nop,nop,TS val 27734883 ecr 111237281], length 0
1761307139.785511 ens4  Out IP atnog-brokers-001.europe-southwest1-b.c.route25ic-p-904873.internal.1883 > 10.254.240.1.34342: Flags [.], ack 223635, win 18926, options [nop,nop,TS val 27734883 ecr 111237281], length 0
1761307139.986625 ens4  In  IP 10.254.240.1.34342 > atnog-brokers-001.europe-southwest1-b.c.route25ic-p-904873.internal.1883: Flags [P.], seq 223635:226451, ack 1, win 502, options [nop,nop,TS val 111237481 ecr 27734682], length 2816
1761307139.986626 ens4  In  IP 10.254.240.1.34342 > atnog-brokers-001.europe-southwest1-b.c.route25ic-p-904873.internal.1883: Flags [P.], seq 226451:228581, ack 1, win 502, options [nop,nop,TS val 111237481 ecr 27734682], length 2130
1761307139.986626 ens4  In  IP 10.254.240.1.34342 > atnog-brokers-001.europe-southwest1-b.c.route25ic-p-904873.internal.1883: Flags [P.], seq 228581:231397, ack 1, win 502, options [nop,nop,TS val 111237581 ecr 27734682], length 2816
1761307139.986626 ens4  In  IP 10.254.240.1.34342 > atnog-brokers-001.europe-southwest1-b.c.route25ic-p-904873.internal.1883: Flags [P.], seq 231397:233527, ack 1, win 502, options [nop,nop,TS val 111237581 ecr 27734682], length 2130
1761307139.986691 ens4  Out IP atnog-brokers-001.europe-southwest1-b.c.route25ic-p-904873.internal.1883 > 10.254.240.1.34342: Flags [.], ack 226451, win 18981, options [nop,nop,TS val 27735084 ecr 111237481], length 0
1761307139.986747 ens4  Out IP atnog-brokers-001.europe-southwest1-b.c.route25ic-p-904873.internal.1883 > 10.254.240.1.34342: Flags [.], ack 233527, win 18926, options [nop,nop,TS val 27735084 ecr 111237481], length 0
1761307140.187583 ens4  In  IP 10.254.240.1.34342 > atnog-brokers-001.europe-southwest1-b.c.route25ic-p-904873.internal.1883: Flags [P.], seq 233527:236343, ack 1, win 502, options [nop,nop,TS val 111237681 ecr 27734883], length 2816
1761307140.187583 ens4  In  IP 10.254.240.1.34342 > atnog-brokers-001.europe-southwest1-b.c.route25ic-p-904873.internal.1883: Flags [P.], seq 236343:238473, ack 1, win 502, options [nop,nop,TS val 111237681 ecr 27734883], length 2130
1761307140.187648 ens4  Out IP atnog-brokers-001.europe-southwest1-b.c.route25ic-p-904873.internal.1883 > 10.254.240.1.34342: Flags [.], ack 236343, win 18981, options [nop,nop,TS val 27735285 ecr 111237681], length 0
1761307140.187664 ens4  In  IP 10.254.240.1.34342 > atnog-brokers-001.europe-southwest1-b.c.route25ic-p-904873.internal.1883: Flags [P.], seq 238473:241289, ack 1, win 502, options [nop,nop,TS val 111237782 ecr 27734883], length 2816
1761307140.187664 ens4  In  IP 10.254.240.1.34342 > atnog-brokers-001.europe-southwest1-b.c.route25ic-p-904873.internal.1883: Flags [P.], seq 241289:243419, ack 1, win 502, options [nop,nop,TS val 111237782 ecr 27734883], length 2130
1761307140.187664 ens4  In  IP 10.254.240.1.34342 > atnog-brokers-001.europe-southwest1-b.c.route25ic-p-904873.internal.1883: Flags [P.], seq 243419:246235, ack 1, win 502, options [nop,nop,TS val 111237882 ecr 27735084], length 2816
1761307140.187664 ens4  In  IP 10.254.240.1.34342 > atnog-brokers-001.europe-southwest1-b.c.route25ic-p-904873.internal.1883: Flags [P.], seq 246235:248365, ack 1, win 502, options [nop,nop,TS val 111237882 ecr 27735084], length 2130
1761307140.187664 ens4  In  IP 10.254.240.1.34342 > atnog-brokers-001.europe-southwest1-b.c.route25ic-p-904873.internal.1883: Flags [P.], seq 248365:251181, ack 1, win 502, options [nop,nop,TS val 111237982 ecr 27735084], length 2816
1761307140.187664 ens4  In  IP 10.254.240.1.34342 > atnog-brokers-001.europe-southwest1-b.c.route25ic-p-904873.internal.1883: Flags [P.], seq 251181:253310, ack 1, win 502, options [nop,nop,TS val 111237982 ecr 27735084], length 2129
1761307140.187720 ens4  Out IP atnog-brokers-001.europe-southwest1-b.c.route25ic-p-904873.internal.1883 > 10.254.240.1.34342: Flags [.], ack 253310, win 18849, options [nop,nop,TS val 27735285 ecr 111237681], length 0
1761307140.476212 ens4  In  IP 10.254.240.1.34342 > atnog-brokers-001.europe-southwest1-b.c.route25ic-p-904873.internal.1883: Flags [.], seq 253310:254718, ack 1, win 502, options [nop,nop,TS val 111238082 ecr 27735285], length 1408
1761307140.517167 ens4  Out IP atnog-brokers-001.europe-southwest1-b.c.route25ic-p-904873.internal.1883 > 10.254.240.1.34342: Flags [.], ack 254718, win 18996, options [nop,nop,TS val 27735615 ecr 111238082], length 0
1761307140.676534 ens4  In  IP 10.254.240.1.34342 > atnog-brokers-001.europe-southwest1-b.c.route25ic-p-904873.internal.1883: Flags [P.], seq 254718:256126, ack 1, win 502, options [nop,nop,TS val 111238082 ecr 27735285], length 1408
1761307140.676534 ens4  In  IP 10.254.240.1.34342 > atnog-brokers-001.europe-southwest1-b.c.route25ic-p-904873.internal.1883: Flags [P.], seq 256126:258257, ack 1, win 502, options [nop,nop,TS val 111238082 ecr 27735285], length 2131
1761307140.676534 ens4  In  IP 10.254.240.1.34342 > atnog-brokers-001.europe-southwest1-b.c.route25ic-p-904873.internal.1883: Flags [P.], seq 258257:261073, ack 1, win 502, options [nop,nop,TS val 111238183 ecr 27735285], length 2816
