1760378635.115440 eth0  In  IP 10.42.0.1.52918 > c2e-hono-adapter-mqtt-5b5fcd88df-p284b.8883: Flags [S], seq 2495704661, win 64240, options [mss 1460,sackOK,TS val 2642328970 ecr 0,nop,wscale 7], length 0
1760378635.115486 eth0  Out IP c2e-hono-adapter-mqtt-5b5fcd88df-p284b.8883 > 10.42.0.1.52918: Flags [S.], seq 4180195312, ack 2495704662, win 64308, options [mss 1410,sackOK,TS val 2764733396 ecr 2642328970,nop,wscale 7], length 0
1760378635.128614 eth0  In  IP 10.42.0.1.52918 > c2e-hono-adapter-mqtt-5b5fcd88df-p284b.8883: Flags [P.], seq 1:518, ack 1, win 502, options [nop,nop,TS val 2642328998 ecr 2764733396], length 517
1760378635.128693 eth0  Out IP c2e-hono-adapter-mqtt-5b5fcd88df-p284b.8883 > 10.42.0.1.52918: Flags [.], ack 518, win 501, options [nop,nop,TS val 2764733409 ecr 2642328998], length 0
1760378635.130340 eth0  In  IP 10.42.0.1.52918 > c2e-hono-adapter-mqtt-5b5fcd88df-p284b.8883: Flags [.], ack 1, win 502, options [nop,nop,TS val 2642328997 ecr 2764733396], length 0
1760378635.130354 eth0  Out IP c2e-hono-adapter-mqtt-5b5fcd88df-p284b.8883 > 10.42.0.1.52918: Flags [.], ack 518, win 501, options [nop,nop,TS val 2764733411 ecr 2642328998], length 0
1760378635.143469 eth0  Out IP c2e-hono-adapter-mqtt-5b5fcd88df-p284b.8883 > 10.42.0.1.52918: Flags [P.], seq 1:1566, ack 518, win 501, options [nop,nop,TS val 2764733424 ecr 2642328998], length 1565
1760378635.158789 eth0  In  IP 10.42.0.1.52918 > c2e-hono-adapter-mqtt-5b5fcd88df-p284b.8883: Flags [.], ack 1399, win 501, options [nop,nop,TS val 2642329025 ecr 2764733424], length 0
1760378635.158805 eth0  In  IP 10.42.0.1.52918 > c2e-hono-adapter-mqtt-5b5fcd88df-p284b.8883: Flags [.], ack 1566, win 500, options [nop,nop,TS val 2642329025 ecr 2764733424], length 0
1760378635.158816 eth0  In  IP 10.42.0.1.52918 > c2e-hono-adapter-mqtt-5b5fcd88df-p284b.8883: Flags [P.], seq 518:628, ack 1566, win 501, options [nop,nop,TS val 2642329027 ecr 2764733424], length 110
1760378635.164104 eth0  Out IP c2e-hono-adapter-mqtt-5b5fcd88df-p284b.8883 > 10.42.0.1.52918: Flags [P.], seq 1566:3002, ack 628, win 501, options [nop,nop,TS val 2764733444 ecr 2642329027], length 1436
1760378635.175353 eth0  In  IP 10.42.0.1.52918 > c2e-hono-adapter-mqtt-5b5fcd88df-p284b.8883: Flags [.], ack 3002, win 501, options [nop,nop,TS val 2642329046 ecr 2764733444], length 0
1760378635.183562 eth0  In  IP 10.42.0.1.52918 > c2e-hono-adapter-mqtt-5b5fcd88df-p284b.8883: Flags [P.], seq 628:701, ack 2964, win 501, options [nop,nop,TS val 2642329046 ecr 2764733444], length 73
1760378635.225338 eth0  Out IP c2e-hono-adapter-mqtt-5b5fcd88df-p284b.8883 > 10.42.0.1.52918: Flags [.], ack 701, win 501, options [nop,nop,TS val 2764733506 ecr 2642329027], length 0
1760378635.423333 eth0  Out IP c2e-hono-adapter-mqtt-5b5fcd88df-p284b.8883 > 10.42.0.1.52918: Flags [P.], seq 3002:3044, ack 701, win 501, options [nop,nop,TS val 2764733704 ecr 2642329027], length 42
1760378635.435882 eth0  In  IP 10.42.0.1.52918 > c2e-hono-adapter-mqtt-5b5fcd88df-p284b.8883: Flags [.], ack 3044, win 501, options [nop,nop,TS val 2642329305 ecr 2764733704], length 0
1760378637.238815 eth0  In  IP 10.42.0.1.52918 > c2e-hono-adapter-mqtt-5b5fcd88df-p284b.8883: Flags [P.], seq 1355:2017, ack 3044, win 501, options [nop,nop,TS val 2642331090 ecr 2764733704], length 662
1760378637.238903 eth0  Out IP c2e-hono-adapter-mqtt-5b5fcd88df-p284b.8883 > 10.42.0.1.52918: Flags [.], ack 701, win 501, options [nop,nop,TS val 2764735519 ecr 2642329305,nop,nop,sack 1 {1355:2017}], length 0
1760378637.258353 eth0  In  IP 10.42.0.1.52918 > c2e-hono-adapter-mqtt-5b5fcd88df-p284b.8883: Flags [P.], seq 701:1355, ack 3044, win 501, options [nop,nop,TS val 2642331120 ecr 2764735519], length 654
1760378637.258411 eth0  Out IP c2e-hono-adapter-mqtt-5b5fcd88df-p284b.8883 > 10.42.0.1.52918: Flags [.], ack 2017, win 491, options [nop,nop,TS val 2764735539 ecr 2642331120], length 0
1760378637.270425 eth0  In  IP 10.42.0.1.52918 > c2e-hono-adapter-mqtt-5b5fcd88df-p284b.8883: Flags [P.], seq 2017:2679, ack 3044, win 501, options [nop,nop,TS val 2642331140 ecr 2764735539], length 662
1760378637.270493 eth0  Out IP c2e-hono-adapter-mqtt-5b5fcd88df-p284b.8883 > 10.42.0.1.52918: Flags [.], ack 2679, win 486, options [nop,nop,TS val 2764735551 ecr 2642331140], length 0
1760378637.355367 eth0  In  IP 10.42.0.1.52918 > c2e-hono-adapter-mqtt-5b5fcd88df-p284b.8883: Flags [P.], seq 2679:3341, ack 3044, win 501, options [nop,nop,TS val 2642331224 ecr 2764735551], length 662
1760378637.355436 eth0  Out IP c2e-hono-adapter-mqtt-5b5fcd88df-p284b.8883 > 10.42.0.1.52918: Flags [.], ack 3341, win 481, options [nop,nop,TS val 2764735636 ecr 2642331224], length 0
1760378637.460425 eth0  In  IP 10.42.0.1.52918 > c2e-hono-adapter-mqtt-5b5fcd88df-p284b.8883: Flags [P.], seq 3341:4003, ack 3044, win 501, options [nop,nop,TS val 2642331325 ecr 2764735636], length 662
1760378637.460506 eth0  Out IP c2e-hono-adapter-mqtt-5b5fcd88df-p284b.8883 > 10.42.0.1.52918: Flags [.], ack 4003, win 476, options [nop,nop,TS val 2764735741 ecr 2642331325], length 0
1760378637.561433 eth0  In  IP 10.42.0.1.52918 > c2e-hono-adapter-mqtt-5b5fcd88df-p284b.8883: Flags [P.], seq 4003:4665, ack 3044, win 501, options [nop,nop,TS val 2642331427 ecr 2764735741], length 662
1760378637.561509 eth0  Out IP c2e-hono-adapter-mqtt-5b5fcd88df-p284b.8883 > 10.42.0.1.52918: Flags [.], ack 4665, win 471, options [nop,nop,TS val 2764735842 ecr 2642331427], length 0
1760378637.661119 eth0  In  IP 10.42.0.1.52918 > c2e-hono-adapter-mqtt-5b5fcd88df-p284b.8883: Flags [P.], seq 4665:5327, ack 3044, win 501, options [nop,nop,TS val 2642331527 ecr 2764735842], length 662
1760378637.661179 eth0  Out IP c2e-hono-adapter-mqtt-5b5fcd88df-p284b.8883 > 10.42.0.1.52918: Flags [.], ack 5327, win 466, options [nop,nop,TS val 2764735941 ecr 2642331527], length 0
1760378637.761476 eth0  In  IP 10.42.0.1.52918 > c2e-hono-adapter-mqtt-5b5fcd88df-p284b.8883: Flags [P.], seq 5327:5989, ack 3044, win 501, options [nop,nop,TS val 2642331628 ecr 2764735941], length 662
1760378637.761565 eth0  Out IP c2e-hono-adapter-mqtt-5b5fcd88df-p284b.8883 > 10.42.0.1.52918: Flags [.], ack 5989, win 461, options [nop,nop,TS val 2764736042 ecr 2642331628], length 0
1760378637.861823 eth0  In  IP 10.42.0.1.52918 > c2e-hono-adapter-mqtt-5b5fcd88df-p284b.8883: Flags [P.], seq 5989:6651, ack 3044, win 501, options [nop,nop,TS val 2642331729 ecr 2764736042], length 662
1760378637.861921 eth0  Out IP c2e-hono-adapter-mqtt-5b5fcd88df-p284b.8883 > 10.42.0.1.52918: Flags [.], ack 6651, win 456, options [nop,nop,TS val 2764736142 ecr 2642331729], length 0
1760378637.965368 eth0  In  IP 10.42.0.1.52918 > c2e-hono-adapter-mqtt-5b5fcd88df-p284b.8883: Flags [P.], seq 6651:7313, ack 3044, win 501, options [nop,nop,TS val 2642331830 ecr 2764736142], length 662
1760378637.965431 eth0  Out IP c2e-hono-adapter-mqtt-5b5fcd88df-p284b.8883 > 10.42.0.1.52918: Flags [.], ack 7313, win 451, options [nop,nop,TS val 2764736246 ecr 2642331830], length 0
1760378638.065656 eth0  In  IP 10.42.0.1.52918 > c2e-hono-adapter-mqtt-5b5fcd88df-p284b.8883: Flags [P.], seq 7313:7975, ack 3044, win 501, options [nop,nop,TS val 2642331931 ecr 2764736246], length 662
1760378638.065774 eth0  Out IP c2e-hono-adapter-mqtt-5b5fcd88df-p284b.8883 > 10.42.0.1.52918: Flags [.], ack 7975, win 446, options [nop,nop,TS val 2764736346 ecr 2642331931], length 0
1760378638.165428 eth0  In  IP 10.42.0.1.52918 > c2e-hono-adapter-mqtt-5b5fcd88df-p284b.8883: Flags [P.], seq 7975:8637, ack 3044, win 501, options [nop,nop,TS val 2642332032 ecr 2764736346], length 662
1760378638.165479 eth0  Out IP c2e-hono-adapter-mqtt-5b5fcd88df-p284b.8883 > 10.42.0.1.52918: Flags [.], ack 8637, win 441, options [nop,nop,TS val 2764736446 ecr 2642332032], length 0
1760378638.266074 eth0  In  IP 10.42.0.1.52918 > c2e-hono-adapter-mqtt-5b5fcd88df-p284b.8883: Flags [P.], seq 8637:9299, ack 3044, win 501, options [nop,nop,TS val 2642332133 ecr 2764736446], length 662
1760378638.266129 eth0  Out IP c2e-hono-adapter-mqtt-5b5fcd88df-p284b.8883 > 10.42.0.1.52918: Flags [.], ack 9299, win 436, options [nop,nop,TS val 2764736546 ecr 2642332133], length 0
1760378638.366049 eth0  In  IP 10.42.0.1.52918 > c2e-hono-adapter-mqtt-5b5fcd88df-p284b.8883: Flags [P.], seq 9299:9961, ack 3044, win 501, options [nop,nop,TS val 2642332234 ecr 2764736546], length 662
1760378638.366120 eth0  Out IP c2e-hono-adapter-mqtt-5b5fcd88df-p284b.8883 > 10.42.0.1.52918: Flags [.], ack 9961, win 431, options [nop,nop,TS val 2764736646 ecr 2642332234], length 0
1760378638.470388 eth0  In  IP 10.42.0.1.52918 > c2e-hono-adapter-mqtt-5b5fcd88df-p284b.8883: Flags [P.], seq 9961:10623, ack 3044, win 501, options [nop,nop,TS val 2642332335 ecr 2764736646], length 662
1760378638.470436 eth0  Out IP c2e-hono-adapter-mqtt-5b5fcd88df-p284b.8883 > 10.42.0.1.52918: Flags [.], ack 10623, win 426, options [nop,nop,TS val 2764736751 ecr 2642332335], length 0
1760378638.570590 eth0  In  IP 10.42.0.1.52918 > c2e-hono-adapter-mqtt-5b5fcd88df-p284b.8883: Flags [P.], seq 10623:11285, ack 3044, win 501, options [nop,nop,TS val 2642332436 ecr 2764736751], length 662
1760378638.570662 eth0  Out IP c2e-hono-adapter-mqtt-5b5fcd88df-p284b.8883 > 10.42.0.1.52918: Flags [.], ack 11285, win 421, options [nop,nop,TS val 2764736851 ecr 2642332436], length 0
1760378638.778636 eth0  In  IP 10.42.0.1.52918 > c2e-hono-adapter-mqtt-5b5fcd88df-p284b.8883: Flags [P.], seq 11947:12609, ack 3044, win 501, options [nop,nop,TS val 2642332638 ecr 2764736851], length 662
1760378638.778672 eth0  Out IP c2e-hono-adapter-mqtt-5b5fcd88df-p284b.8883 > 10.42.0.1.52918: Flags [.], ack 11285, win 421, options [nop,nop,TS val 2764737059 ecr 2642332436,nop,nop,sack 1 {11947:12609}], length 0
1760378638.795660 eth0  In  IP 10.42.0.1.52918 > c2e-hono-adapter-mqtt-5b5fcd88df-p284b.8883: Flags [P.], seq 11285:11947, ack 3044, win 501, options [nop,nop,TS val 2642332660 ecr 2764737059], length 662
1760378638.795723 eth0  Out IP c2e-hono-adapter-mqtt-5b5fcd88df-p284b.8883 > 10.42.0.1.52918: Flags [.], ack 12609, win 411, options [nop,nop,TS val 2764737076 ecr 2642332660], length 0
1760378638.870536 eth0  In  IP 10.42.0.1.52918 > c2e-hono-adapter-mqtt-5b5fcd88df-p284b.8883: Flags [P.], seq 12609:13271, ack 3044, win 501, options [nop,nop,TS val 2642332739 ecr 2764737076], length 662
1760378638.870604 eth0  Out IP c2e-hono-adapter-mqtt-5b5fcd88df-p284b.8883 > 10.42.0.1.52918: Flags [.], ack 13271, win 406, options [nop,nop,TS val 2764737151 ecr 2642332739], length 0
1760378638.973625 eth0  In  IP 10.42.0.1.52918 > c2e-hono-adapter-mqtt-5b5fcd88df-p284b.8883: Flags [P.], seq 13271:13933, ack 3044, win 501, options [nop,nop,TS val 2642332840 ecr 2764737151], length 662
1760378638.973673 eth0  Out IP c2e-hono-adapter-mqtt-5b5fcd88df-p284b.8883 > 10.42.0.1.52918: Flags [.], ack 13933, win 401, options [nop,nop,TS val 2764737254 ecr 2642332840], length 0
1760378639.083725 eth0  In  IP 10.42.0.1.52918 > c2e-hono-adapter-mqtt-5b5fcd88df-p284b.8883: Flags [P.], seq 13933:14595, ack 3044, win 501, options [nop,nop,TS val 2642332940 ecr 2764737254], length 662
1760378639.084019 eth0  Out IP c2e-hono-adapter-mqtt-5b5fcd88df-p284b.8883 > 10.42.0.1.52918: Flags [.], ack 14595, win 396, options [nop,nop,TS val 2764737364 ecr 2642332940], length 0
1760378639.178852 eth0  In  IP 10.42.0.1.52918 > c2e-hono-adapter-mqtt-5b5fcd88df-p284b.8883: Flags [P.], seq 14595:15257, ack 3044, win 501, options [nop,nop,TS val 2642333041 ecr 2764737364], length 662
1760378639.178973 eth0  Out IP c2e-hono-adapter-mqtt-5b5fcd88df-p284b.8883 > 10.42.0.1.52918: Flags [.], ack 15257, win 391, options [nop,nop,TS val 2764737459 ecr 2642333041], length 0
1760378639.283801 eth0  In  IP 10.42.0.1.52918 > c2e-hono-adapter-mqtt-5b5fcd88df-p284b.8883: Flags [P.], seq 15257:15919, ack 3044, win 501, options [nop,nop,TS val 2642333142 ecr 2764737459], length 662
1760378639.283873 eth0  Out IP c2e-hono-adapter-mqtt-5b5fcd88df-p284b.8883 > 10.42.0.1.52918: Flags [.], ack 15919, win 386, options [nop,nop,TS val 2764737564 ecr 2642333142], length 0
1760378639.375846 eth0  In  IP 10.42.0.1.52918 > c2e-hono-adapter-mqtt-5b5fcd88df-p284b.8883: Flags [P.], seq 15919:16581, ack 3044, win 501, options [nop,nop,TS val 2642333243 ecr 2764737564], length 662
1760378639.375943 eth0  Out IP c2e-hono-adapter-mqtt-5b5fcd88df-p284b.8883 > 10.42.0.1.52918: Flags [.], ack 16581, win 381, options [nop,nop,TS val 2764737656 ecr 2642333243], length 0
1760378639.476281 eth0  In  IP 10.42.0.1.52918 > c2e-hono-adapter-mqtt-5b5fcd88df-p284b.8883: Flags [P.], seq 16581:17243, ack 3044, win 501, options [nop,nop,TS val 2642333344 ecr 2764737656], length 662
1760378639.476339 eth0  Out IP c2e-hono-adapter-mqtt-5b5fcd88df-p284b.8883 > 10.42.0.1.52918: Flags [.], ack 17243, win 376, options [nop,nop,TS val 2764737757 ecr 2642333344], length 0
1760378639.580354 eth0  In  IP 10.42.0.1.52918 > c2e-hono-adapter-mqtt-5b5fcd88df-p284b.8883: Flags [P.], seq 17243:17905, ack 3044, win 501, options [nop,nop,TS val 2642333445 ecr 2764737757], length 662
1760378639.580432 eth0  Out IP c2e-hono-adapter-mqtt-5b5fcd88df-p284b.8883 > 10.42.0.1.52918: Flags [.], ack 17905, win 371, options [nop,nop,TS val 2764737861 ecr 2642333445], length 0
1760378639.683596 eth0  In  IP 10.42.0.1.52918 > c2e-hono-adapter-mqtt-5b5fcd88df-p284b.8883: Flags [P.], seq 17905:18567, ack 3044, win 501, options [nop,nop,TS val 2642333546 ecr 2764737861], length 662
1760378639.683657 eth0  Out IP c2e-hono-adapter-mqtt-5b5fcd88df-p284b.8883 > 10.42.0.1.52918: Flags [.], ack 18567, win 371, options [nop,nop,TS val 2764737964 ecr 2642333546], length 0
1760378639.783389 eth0  In  IP 10.42.0.1.52918 > c2e-hono-adapter-mqtt-5b5fcd88df-p284b.8883: Flags [P.], seq 18567:19229, ack 3044, win 501, options [nop,nop,TS val 2642333647 ecr 2764737964], length 662
1760378639.783495 eth0  Out IP c2e-hono-adapter-mqtt-5b5fcd88df-p284b.8883 > 10.42.0.1.52918: Flags [.], ack 19229, win 371, options [nop,nop,TS val 2764738064 ecr 2642333647], length 0
1760378639.880317 eth0  In  IP 10.42.0.1.52918 > c2e-hono-adapter-mqtt-5b5fcd88df-p284b.8883: Flags [P.], seq 19229:19891, ack 3044, win 501, options [nop,nop,TS val 2642333748 ecr 2764738064], length 662
1760378639.880391 eth0  Out IP c2e-hono-adapter-mqtt-5b5fcd88df-p284b.8883 > 10.42.0.1.52918: Flags [.], ack 19891, win 370, options [nop,nop,TS val 2764738161 ecr 2642333748], length 0
1760378639.980908 eth0  In  IP 10.42.0.1.52918 > c2e-hono-adapter-mqtt-5b5fcd88df-p284b.8883: Flags [P.], seq 19891:20553, ack 3044, win 501, options [nop,nop,TS val 2642333848 ecr 2764738161], length 662
1760378639.980961 eth0  Out IP c2e-hono-adapter-mqtt-5b5fcd88df-p284b.8883 > 10.42.0.1.52918: Flags [.], ack 20553, win 371, options [nop,nop,TS val 2764738261 ecr 2642333848], length 0
1760378640.083583 eth0  In  IP 10.42.0.1.52918 > c2e-hono-adapter-mqtt-5b5fcd88df-p284b.8883: Flags [P.], seq 20553:21215, ack 3044, win 501, options [nop,nop,TS val 2642333949 ecr 2764738261], length 662
1760378640.083690 eth0  Out IP c2e-hono-adapter-mqtt-5b5fcd88df-p284b.8883 > 10.42.0.1.52918: Flags [.], ack 21215, win 371, options [nop,nop,TS val 2764738364 ecr 2642333949], length 0
1760378640.188543 eth0  In  IP 10.42.0.1.52918 > c2e-hono-adapter-mqtt-5b5fcd88df-p284b.8883: Flags [P.], seq 21215:21877, ack 3044, win 501, options [nop,nop,TS val 2642334050 ecr 2764738364], length 662
1760378640.188599 eth0  Out IP c2e-hono-adapter-mqtt-5b5fcd88df-p284b.8883 > 10.42.0.1.52918: Flags [.], ack 21877, win 371, options [nop,nop,TS val 2764738469 ecr 2642334050], length 0
1760378640.288761 eth0  In  IP 10.42.0.1.52918 > c2e-hono-adapter-mqtt-5b5fcd88df-p284b.8883: Flags [P.], seq 21877:22539, ack 3044, win 501, options [nop,nop,TS val 2642334151 ecr 2764738469], length 662
1760378640.288832 eth0  Out IP c2e-hono-adapter-mqtt-5b5fcd88df-p284b.8883 > 10.42.0.1.52918: Flags [.], ack 22539, win 371, options [nop,nop,TS val 2764738569 ecr 2642334151], length 0
1760378640.389322 eth0  In  IP 10.42.0.1.52918 > c2e-hono-adapter-mqtt-5b5fcd88df-p284b.8883: Flags [P.], seq 22539:23201, ack 3044, win 501, options [nop,nop,TS val 2642334252 ecr 2764738569], length 662
1760378640.389815 eth0  Out IP c2e-hono-adapter-mqtt-5b5fcd88df-p284b.8883 > 10.42.0.1.52918: Flags [.], ack 23201, win 376, options [nop,nop,TS val 2764738670 ecr 2642334252], length 0
1760378640.485630 eth0  In  IP 10.42.0.1.52918 > c2e-hono-adapter-mqtt-5b5fcd88df-p284b.8883: Flags [P.], seq 23201:23863, ack 3044, win 501, options [nop,nop,TS val 2642334353 ecr 2764738670], length 662
1760378640.485906 eth0  Out IP c2e-hono-adapter-mqtt-5b5fcd88df-p284b.8883 > 10.42.0.1.52918: Flags [.], ack 23863, win 376, options [nop,nop,TS val 2764738766 ecr 2642334353], length 0
1760378640.586359 eth0  In  IP 10.42.0.1.52918 > c2e-hono-adapter-mqtt-5b5fcd88df-p284b.8883: Flags [P.], seq 23863:24525, ack 3044, win 501, options [nop,nop,TS val 2642334454 ecr 2764738766], length 662
1760378640.586545 eth0  Out IP c2e-hono-adapter-mqtt-5b5fcd88df-p284b.8883 > 10.42.0.1.52918: Flags [.], ack 24525, win 376, options [nop,nop,TS val 2764738867 ecr 2642334454], length 0
1760378640.698533 eth0  In  IP 10.42.0.1.52918 > c2e-hono-adapter-mqtt-5b5fcd88df-p284b.8883: Flags [P.], seq 24525:25187, ack 3044, win 501, options [nop,nop,TS val 2642334555 ecr 2764738867], length 662
1760378640.698767 eth0  Out IP c2e-hono-adapter-mqtt-5b5fcd88df-p284b.8883 > 10.42.0.1.52918: Flags [.], ack 25187, win 376, options [nop,nop,TS val 2764738979 ecr 2642334555], length 0
1760378640.798914 eth0  In  IP 10.42.0.1.52918 > c2e-hono-adapter-mqtt-5b5fcd88df-p284b.8883: Flags [P.], seq 25187:25849, ack 3044, win 501, options [nop,nop,TS val 2642334655 ecr 2764738979], length 662
1760378640.799398 eth0  Out IP c2e-hono-adapter-mqtt-5b5fcd88df-p284b.8883 > 10.42.0.1.52918: Flags [.], ack 25849, win 376, options [nop,nop,TS val 2764739080 ecr 2642334655], length 0
1760378640.893518 eth0  In  IP 10.42.0.1.52918 > c2e-hono-adapter-mqtt-5b5fcd88df-p284b.8883: Flags [P.], seq 25849:26511, ack 3044, win 501, options [nop,nop,TS val 2642334756 ecr 2764739080], length 662
1760378640.893663 eth0  Out IP c2e-hono-adapter-mqtt-5b5fcd88df-p284b.8883 > 10.42.0.1.52918: Flags [.], ack 26511, win 376, options [nop,nop,TS val 2764739174 ecr 2642334756], length 0
1760378640.998486 eth0  In  IP 10.42.0.1.52918 > c2e-hono-adapter-mqtt-5b5fcd88df-p284b.8883: Flags [P.], seq 26511:27173, ack 3044, win 501, options [nop,nop,TS val 2642334857 ecr 2764739174], length 662
1760378640.998734 eth0  Out IP c2e-hono-adapter-mqtt-5b5fcd88df-p284b.8883 > 10.42.0.1.52918: Flags [.], ack 27173, win 376, options [nop,nop,TS val 2764739279 ecr 2642334857], length 0
1760378641.090479 eth0  In  IP 10.42.0.1.52918 > c2e-hono-adapter-mqtt-5b5fcd88df-p284b.8883: Flags [P.], seq 27173:27835, ack 3044, win 501, options [nop,nop,TS val 2642334958 ecr 2764739279], length 662
1760378641.090732 eth0  Out IP c2e-hono-adapter-mqtt-5b5fcd88df-p284b.8883 > 10.42.0.1.52918: Flags [.], ack 27835, win 376, options [nop,nop,TS val 2764739371 ecr 2642334958], length 0
1760378641.191106 eth0  In  IP 10.42.0.1.52918 > c2e-hono-adapter-mqtt-5b5fcd88df-p284b.8883: Flags [P.], seq 27835:28497, ack 3044, win 501, options [nop,nop,TS val 2642335058 ecr 2764739371], length 662
1760378641.191361 eth0  Out IP c2e-hono-adapter-mqtt-5b5fcd88df-p284b.8883 > 10.42.0.1.52918: Flags [.], ack 28497, win 376, options [nop,nop,TS val 2764739472 ecr 2642335058], length 0
1760378641.291967 eth0  In  IP 10.42.0.1.52918 > c2e-hono-adapter-mqtt-5b5fcd88df-p284b.8883: Flags [P.], seq 28497:29159, ack 3044, win 501, options [nop,nop,TS val 2642335159 ecr 2764739472], length 662
1760378641.292202 eth0  Out IP c2e-hono-adapter-mqtt-5b5fcd88df-p284b.8883 > 10.42.0.1.52918: Flags [.], ack 29159, win 376, options [nop,nop,TS val 2764739572 ecr 2642335159], length 0
1760378641.393452 eth0  In  IP 10.42.0.1.52918 > c2e-hono-adapter-mqtt-5b5fcd88df-p284b.8883: Flags [P.], seq 29159:29821, ack 3044, win 501, options [nop,nop,TS val 2642335260 ecr 2764739572], length 662
1760378641.393586 eth0  Out IP c2e-hono-adapter-mqtt-5b5fcd88df-p284b.8883 > 10.42.0.1.52918: Flags [.], ack 29821, win 376, options [nop,nop,TS val 2764739674 ecr 2642335260], length 0
1760378641.493821 eth0  In  IP 10.42.0.1.52918 > c2e-hono-adapter-mqtt-5b5fcd88df-p284b.8883: Flags [P.], seq 29821:30483, ack 3044, win 501, options [nop,nop,TS val 2642335361 ecr 2764739674], length 662
1760378641.494046 eth0  Out IP c2e-hono-adapter-mqtt-5b5fcd88df-p284b.8883 > 10.42.0.1.52918: Flags [.], ack 30483, win 376, options [nop,nop,TS val 2764739774 ecr 2642335361], length 0
1760378641.598644 eth0  In  IP 10.42.0.1.52918 > c2e-hono-adapter-mqtt-5b5fcd88df-p284b.8883: Flags [P.], seq 30483:31145, ack 3044, win 501, options [nop,nop,TS val 2642335462 ecr 2764739774], length 662
1760378641.598885 eth0  Out IP c2e-hono-adapter-mqtt-5b5fcd88df-p284b.8883 > 10.42.0.1.52918: Flags [.], ack 31145, win 376, options [nop,nop,TS val 2764739879 ecr 2642335462], length 0
1760378641.795542 eth0  In  IP 10.42.0.1.52918 > c2e-hono-adapter-mqtt-5b5fcd88df-p284b.8883: Flags [P.], seq 31807:32469, ack 3044, win 501, options [nop,nop,TS val 2642335663 ecr 2764739879], length 662
1760378641.795640 eth0  Out IP c2e-hono-adapter-mqtt-5b5fcd88df-p284b.8883 > 10.42.0.1.52918: Flags [.], ack 31145, win 376, options [nop,nop,TS val 2764740076 ecr 2642335462,nop,nop,sack 1 {31807:32469}], length 0
1760378641.813607 eth0  In  IP 10.42.0.1.52918 > c2e-hono-adapter-mqtt-5b5fcd88df-p284b.8883: Flags [P.], seq 31145:31807, ack 3044, win 501, options [nop,nop,TS val 2642335677 ecr 2764740076], length 662
1760378641.813696 eth0  Out IP c2e-hono-adapter-mqtt-5b5fcd88df-p284b.8883 > 10.42.0.1.52918: Flags [.], ack 32469, win 370, options [nop,nop,TS val 2764740094 ecr 2642335677], length 0
1760378641.896155 eth0  In  IP 10.42.0.1.52918 > c2e-hono-adapter-mqtt-5b5fcd88df-p284b.8883: Flags [P.], seq 32469:33131, ack 3044, win 501, options [nop,nop,TS val 2642335764 ecr 2764740094], length 662
1760378641.896234 eth0  Out IP c2e-hono-adapter-mqtt-5b5fcd88df-p284b.8883 > 10.42.0.1.52918: Flags [.], ack 33131, win 371, options [nop,nop,TS val 2764740176 ecr 2642335764], length 0
1760378642.003439 eth0  In  IP 10.42.0.1.52918 > c2e-hono-adapter-mqtt-5b5fcd88df-p284b.8883: Flags [P.], seq 33131:33793, ack 3044, win 501, options [nop,nop,TS val 2642335865 ecr 2764740176], length 662
1760378642.003538 eth0  Out IP c2e-hono-adapter-mqtt-5b5fcd88df-p284b.8883 > 10.42.0.1.52918: Flags [.], ack 33793, win 371, options [nop,nop,TS val 2764740284 ecr 2642335865], length 0
1760378642.103829 eth0  In  IP 10.42.0.1.52918 > c2e-hono-adapter-mqtt-5b5fcd88df-p284b.8883: Flags [P.], seq 33793:34455, ack 3044, win 501, options [nop,nop,TS val 2642335966 ecr 2764740284], length 662
1760378642.103910 eth0  Out IP c2e-hono-adapter-mqtt-5b5fcd88df-p284b.8883 > 10.42.0.1.52918: Flags [.], ack 34455, win 371, options [nop,nop,TS val 2764740384 ecr 2642335966], length 0
1760378642.204962 eth0  In  IP 10.42.0.1.52918 > c2e-hono-adapter-mqtt-5b5fcd88df-p284b.8883: Flags [P.], seq 34455:35117, ack 3044, win 501, options [nop,nop,TS val 2642336067 ecr 2764740384], length 662
1760378642.205020 eth0  Out IP c2e-hono-adapter-mqtt-5b5fcd88df-p284b.8883 > 10.42.0.1.52918: Flags [.], ack 35117, win 371, options [nop,nop,TS val 2764740485 ecr 2642336067], length 0
1760378642.303475 eth0  In  IP 10.42.0.1.52918 > c2e-hono-adapter-mqtt-5b5fcd88df-p284b.8883: Flags [P.], seq 35117:35779, ack 3044, win 501, options [nop,nop,TS val 2642336167 ecr 2764740485], length 662
1760378642.303551 eth0  Out IP c2e-hono-adapter-mqtt-5b5fcd88df-p284b.8883 > 10.42.0.1.52918: Flags [.], ack 35779, win 371, options [nop,nop,TS val 2764740584 ecr 2642336167], length 0
1760378642.400573 eth0  In  IP 10.42.0.1.52918 > c2e-hono-adapter-mqtt-5b5fcd88df-p284b.8883: Flags [P.], seq 35779:36441, ack 3044, win 501, options [nop,nop,TS val 2642336268 ecr 2764740584], length 662
1760378642.400673 eth0  Out IP c2e-hono-adapter-mqtt-5b5fcd88df-p284b.8883 > 10.42.0.1.52918: Flags [.], ack 36441, win 371, options [nop,nop,TS val 2764740681 ecr 2642336268], length 0
1760378642.505424 eth0  In  IP 10.42.0.1.52918 > c2e-hono-adapter-mqtt-5b5fcd88df-p284b.8883: Flags [P.], seq 36441:37103, ack 3044, win 501, options [nop,nop,TS val 2642336369 ecr 2764740681], length 662
1760378642.505495 eth0  Out IP c2e-hono-adapter-mqtt-5b5fcd88df-p284b.8883 > 10.42.0.1.52918: Flags [.], ack 37103, win 371, options [nop,nop,TS val 2764740786 ecr 2642336369], length 0
1760378642.608625 eth0  In  IP 10.42.0.1.52918 > c2e-hono-adapter-mqtt-5b5fcd88df-p284b.8883: Flags [P.], seq 37103:37765, ack 3044, win 501, options [nop,nop,TS val 2642336470 ecr 2764740786], length 662
1760378642.608695 eth0  Out IP c2e-hono-adapter-mqtt-5b5fcd88df-p284b.8883 > 10.42.0.1.52918: Flags [.], ack 37765, win 371, options [nop,nop,TS val 2764740889 ecr 2642336470], length 0
1760378642.719038 eth0  In  IP 10.42.0.1.52918 > c2e-hono-adapter-mqtt-5b5fcd88df-p284b.8883: Flags [P.], seq 37765:38427, ack 3044, win 501, options [nop,nop,TS val 2642336570 ecr 2764740889], length 662
1760378642.719123 eth0  Out IP c2e-hono-adapter-mqtt-5b5fcd88df-p284b.8883 > 10.42.0.1.52918: Flags [.], ack 38427, win 371, options [nop,nop,TS val 2764740999 ecr 2642336570], length 0
1760378642.805379 eth0  In  IP 10.42.0.1.52918 > c2e-hono-adapter-mqtt-5b5fcd88df-p284b.8883: Flags [P.], seq 38427:39089, ack 3044, win 501, options [nop,nop,TS val 2642336671 ecr 2764740999], length 662
1760378642.805444 eth0  Out IP c2e-hono-adapter-mqtt-5b5fcd88df-p284b.8883 > 10.42.0.1.52918: Flags [.], ack 39089, win 371, options [nop,nop,TS val 2764741086 ecr 2642336671], length 0
1760378642.913401 eth0  In  IP 10.42.0.1.52918 > c2e-hono-adapter-mqtt-5b5fcd88df-p284b.8883: Flags [P.], seq 39089:39751, ack 3044, win 501, options [nop,nop,TS val 2642336772 ecr 2764741086], length 662
1760378642.913482 eth0  Out IP c2e-hono-adapter-mqtt-5b5fcd88df-p284b.8883 > 10.42.0.1.52918: Flags [.], ack 39751, win 371, options [nop,nop,TS val 2764741194 ecr 2642336772], length 0
1760378643.005626 eth0  In  IP 10.42.0.1.52918 > c2e-hono-adapter-mqtt-5b5fcd88df-p284b.8883: Flags [P.], seq 39751:40413, ack 3044, win 501, options [nop,nop,TS val 2642336873 ecr 2764741194], length 662
1760378643.005718 eth0  Out IP c2e-hono-adapter-mqtt-5b5fcd88df-p284b.8883 > 10.42.0.1.52918: Flags [.], ack 40413, win 371, options [nop,nop,TS val 2764741286 ecr 2642336873], length 0
1760378643.108522 eth0  In  IP 10.42.0.1.52918 > c2e-hono-adapter-mqtt-5b5fcd88df-p284b.8883: Flags [P.], seq 40413:41075, ack 3044, win 501, options [nop,nop,TS val 2642336974 ecr 2764741286], length 662
1760378643.108580 eth0  Out IP c2e-hono-adapter-mqtt-5b5fcd88df-p284b.8883 > 10.42.0.1.52918: Flags [.], ack 41075, win 371, options [nop,nop,TS val 2764741389 ecr 2642336974], length 0
1760378643.213419 eth0  In  IP 10.42.0.1.52918 > c2e-hono-adapter-mqtt-5b5fcd88df-p284b.8883: Flags [P.], seq 41075:41737, ack 3044, win 501, options [nop,nop,TS val 2642337075 ecr 2764741389], length 662
1760378643.213602 eth0  Out IP c2e-hono-adapter-mqtt-5b5fcd88df-p284b.8883 > 10.42.0.1.52918: Flags [.], ack 41737, win 371, options [nop,nop,TS val 2764741494 ecr 2642337075], length 0
1760378643.314066 eth0  In  IP 10.42.0.1.52918 > c2e-hono-adapter-mqtt-5b5fcd88df-p284b.8883: Flags [P.], seq 41737:42399, ack 3044, win 501, options [nop,nop,TS val 2642337176 ecr 2764741494], length 662
1760378643.314119 eth0  Out IP c2e-hono-adapter-mqtt-5b5fcd88df-p284b.8883 > 10.42.0.1.52918: Flags [.], ack 42399, win 371, options [nop,nop,TS val 2764741594 ecr 2642337176], length 0
1760378643.418782 eth0  In  IP 10.42.0.1.52918 > c2e-hono-adapter-mqtt-5b5fcd88df-p284b.8883: Flags [P.], seq 42399:43061, ack 3044, win 501, options [nop,nop,TS val 2642337277 ecr 2764741594], length 662
1760378643.418954 eth0  Out IP c2e-hono-adapter-mqtt-5b5fcd88df-p284b.8883 > 10.42.0.1.52918: Flags [.], ack 43061, win 376, options [nop,nop,TS val 2764741699 ecr 2642337277], length 0
1760378643.513478 eth0  In  IP 10.42.0.1.52918 > c2e-hono-adapter-mqtt-5b5fcd88df-p284b.8883: Flags [P.], seq 43061:43723, ack 3044, win 501, options [nop,nop,TS val 2642337377 ecr 2764741699], length 662
1760378643.513713 eth0  Out IP c2e-hono-adapter-mqtt-5b5fcd88df-p284b.8883 > 10.42.0.1.52918: Flags [.], ack 43723, win 376, options [nop,nop,TS val 2764741794 ecr 2642337377], length 0
1760378643.610598 eth0  In  IP 10.42.0.1.52918 > c2e-hono-adapter-mqtt-5b5fcd88df-p284b.8883: Flags [P.], seq 43723:44385, ack 3044, win 501, options [nop,nop,TS val 2642337478 ecr 2764741794], length 662
1760378643.610767 eth0  Out IP c2e-hono-adapter-mqtt-5b5fcd88df-p284b.8883 > 10.42.0.1.52918: Flags [.], ack 44385, win 376, options [nop,nop,TS val 2764741891 ecr 2642337478], length 0
1760378643.710882 eth0  In  IP 10.42.0.1.52918 > c2e-hono-adapter-mqtt-5b5fcd88df-p284b.8883: Flags [P.], seq 44385:45047, ack 3044, win 501, options [nop,nop,TS val 2642337578 ecr 2764741891], length 662
1760378643.711066 eth0  Out IP c2e-hono-adapter-mqtt-5b5fcd88df-p284b.8883 > 10.42.0.1.52918: Flags [.], ack 45047, win 376, options [nop,nop,TS val 2764741991 ecr 2642337578], length 0
1760378643.813558 eth0  In  IP 10.42.0.1.52918 > c2e-hono-adapter-mqtt-5b5fcd88df-p284b.8883: Flags [P.], seq 45047:45709, ack 3044, win 501, options [nop,nop,TS val 2642337679 ecr 2764741991], length 662
1760378643.813780 eth0  Out IP c2e-hono-adapter-mqtt-5b5fcd88df-p284b.8883 > 10.42.0.1.52918: Flags [.], ack 45709, win 376, options [nop,nop,TS val 2764742094 ecr 2642337679], length 0
1760378643.918534 eth0  In  IP 10.42.0.1.52918 > c2e-hono-adapter-mqtt-5b5fcd88df-p284b.8883: Flags [P.], seq 45709:46371, ack 3044, win 501, options [nop,nop,TS val 2642337780 ecr 2764742094], length 662
1760378643.918837 eth0  Out IP c2e-hono-adapter-mqtt-5b5fcd88df-p284b.8883 > 10.42.0.1.52918: Flags [.], ack 46371, win 376, options [nop,nop,TS val 2764742199 ecr 2642337780], length 0
1760378644.019567 eth0  In  IP 10.42.0.1.52918 > c2e-hono-adapter-mqtt-5b5fcd88df-p284b.8883: Flags [P.], seq 46371:47033, ack 3044, win 501, options [nop,nop,TS val 2642337880 ecr 2764742199], length 662
1760378644.019777 eth0  Out IP c2e-hono-adapter-mqtt-5b5fcd88df-p284b.8883 > 10.42.0.1.52918: Flags [.], ack 47033, win 376, options [nop,nop,TS val 2764742300 ecr 2642337880], length 0
1760378644.118816 eth0  In  IP 10.42.0.1.52918 > c2e-hono-adapter-mqtt-5b5fcd88df-p284b.8883: Flags [P.], seq 47033:47695, ack 3044, win 501, options [nop,nop,TS val 2642337981 ecr 2764742300], length 662
1760378644.119014 eth0  Out IP c2e-hono-adapter-mqtt-5b5fcd88df-p284b.8883 > 10.42.0.1.52918: Flags [.], ack 47695, win 376, options [nop,nop,TS val 2764742399 ecr 2642337981], length 0
1760378644.215702 eth0  In  IP 10.42.0.1.52918 > c2e-hono-adapter-mqtt-5b5fcd88df-p284b.8883: Flags [P.], seq 47695:48357, ack 3044, win 501, options [nop,nop,TS val 2642338082 ecr 2764742399], length 662
1760378644.215950 eth0  Out IP c2e-hono-adapter-mqtt-5b5fcd88df-p284b.8883 > 10.42.0.1.52918: Flags [.], ack 48357, win 376, options [nop,nop,TS val 2764742496 ecr 2642338082], length 0
1760378644.323571 eth0  In  IP 10.42.0.1.52918 > c2e-hono-adapter-mqtt-5b5fcd88df-p284b.8883: Flags [P.], seq 48357:49019, ack 3044, win 501, options [nop,nop,TS val 2642338188 ecr 2764742496], length 662
1760378644.323825 eth0  Out IP c2e-hono-adapter-mqtt-5b5fcd88df-p284b.8883 > 10.42.0.1.52918: Flags [.], ack 49019, win 376, options [nop,nop,TS val 2764742604 ecr 2642338188], length 0
1760378644.415888 eth0  In  IP 10.42.0.1.52918 > c2e-hono-adapter-mqtt-5b5fcd88df-p284b.8883: Flags [P.], seq 49019:49681, ack 3044, win 501, options [nop,nop,TS val 2642338284 ecr 2764742604], length 662
1760378644.416140 eth0  Out IP c2e-hono-adapter-mqtt-5b5fcd88df-p284b.8883 > 10.42.0.1.52918: Flags [.], ack 49681, win 376, options [nop,nop,TS val 2764742696 ecr 2642338284], length 0
1760378644.623790 eth0  In  IP 10.42.0.1.52918 > c2e-hono-adapter-mqtt-5b5fcd88df-p284b.8883: Flags [P.], seq 50343:51005, ack 3044, win 501, options [nop,nop,TS val 2642338485 ecr 2764742696], length 662
1760378644.623828 eth0  Out IP c2e-hono-adapter-mqtt-5b5fcd88df-p284b.8883 > 10.42.0.1.52918: Flags [.], ack 49681, win 376, options [nop,nop,TS val 2764742904 ecr 2642338284,nop,nop,sack 1 {50343:51005}], length 0
1760378644.640367 eth0  In  IP 10.42.0.1.52918 > c2e-hono-adapter-mqtt-5b5fcd88df-p284b.8883: Flags [P.], seq 49681:50343, ack 3044, win 501, options [nop,nop,TS val 2642338505 ecr 2764742904], length 662
1760378644.640446 eth0  Out IP c2e-hono-adapter-mqtt-5b5fcd88df-p284b.8883 > 10.42.0.1.52918: Flags [.], ack 51005, win 367, options [nop,nop,TS val 2764742921 ecr 2642338505], length 0
1760378644.723146 eth0  In  IP 10.42.0.1.52918 > c2e-hono-adapter-mqtt-5b5fcd88df-p284b.8883: Flags [P.], seq 51005:51667, ack 3044, win 501, options [nop,nop,TS val 2642338585 ecr 2764742921], length 662
1760378644.723249 eth0  Out IP c2e-hono-adapter-mqtt-5b5fcd88df-p284b.8883 > 10.42.0.1.52918: Flags [.], ack 51667, win 371, options [nop,nop,TS val 2764743003 ecr 2642338585], length 0
1760378644.823791 eth0  In  IP 10.42.0.1.52918 > c2e-hono-adapter-mqtt-5b5fcd88df-p284b.8883: Flags [P.], seq 51667:52329, ack 3044, win 501, options [nop,nop,TS val 2642338686 ecr 2764743003], length 662
1760378644.823855 eth0  Out IP c2e-hono-adapter-mqtt-5b5fcd88df-p284b.8883 > 10.42.0.1.52918: Flags [.], ack 52329, win 370, options [nop,nop,TS val 2764743104 ecr 2642338686], length 0
1760378644.928469 eth0  In  IP 10.42.0.1.52918 > c2e-hono-adapter-mqtt-5b5fcd88df-p284b.8883: Flags [P.], seq 52329:52991, ack 3044, win 501, options [nop,nop,TS val 2642338787 ecr 2764743104], length 662
1760378644.928519 eth0  Out IP c2e-hono-adapter-mqtt-5b5fcd88df-p284b.8883 > 10.42.0.1.52918: Flags [.], ack 52991, win 371, options [nop,nop,TS val 2764743209 ecr 2642338787], length 0
1760378645.020738 eth0  In  IP 10.42.0.1.52918 > c2e-hono-adapter-mqtt-5b5fcd88df-p284b.8883: Flags [P.], seq 52991:53653, ack 3044, win 501, options [nop,nop,TS val 2642338888 ecr 2764743209], length 662
1760378645.020840 eth0  Out IP c2e-hono-adapter-mqtt-5b5fcd88df-p284b.8883 > 10.42.0.1.52918: Flags [.], ack 53653, win 371, options [nop,nop,TS val 2764743301 ecr 2642338888], length 0
1760378645.122172 eth0  In  IP 10.42.0.1.52918 > c2e-hono-adapter-mqtt-5b5fcd88df-p284b.8883: Flags [P.], seq 53653:54315, ack 3044, win 501, options [nop,nop,TS val 2642338988 ecr 2764743301], length 662
1760378645.122240 eth0  Out IP c2e-hono-adapter-mqtt-5b5fcd88df-p284b.8883 > 10.42.0.1.52918: Flags [.], ack 54315, win 371, options [nop,nop,TS val 2764743402 ecr 2642338988], length 0
1760378645.220355 eth0  In  IP 10.42.0.1.52918 > c2e-hono-adapter-mqtt-5b5fcd88df-p284b.8883: Flags [P.], seq 54315:54977, ack 3044, win 501, options [nop,nop,TS val 2642339089 ecr 2764743402], length 662
1760378645.220411 eth0  Out IP c2e-hono-adapter-mqtt-5b5fcd88df-p284b.8883 > 10.42.0.1.52918: Flags [.], ack 54977, win 371, options [nop,nop,TS val 2764743501 ecr 2642339089], length 0
1760378645.328252 eth0  In  IP 10.42.0.1.52918 > c2e-hono-adapter-mqtt-5b5fcd88df-p284b.8883: Flags [P.], seq 54977:55639, ack 3044, win 501, options [nop,nop,TS val 2642339190 ecr 2764743501], length 662
1760378645.328329 eth0  Out IP c2e-hono-adapter-mqtt-5b5fcd88df-p284b.8883 > 10.42.0.1.52918: Flags [.], ack 55639, win 371, options [nop,nop,TS val 2764743608 ecr 2642339190], length 0
1760378645.428854 eth0  In  IP 10.42.0.1.52918 > c2e-hono-adapter-mqtt-5b5fcd88df-p284b.8883: Flags [P.], seq 55639:56301, ack 3044, win 501, options [nop,nop,TS val 2642339291 ecr 2764743608], length 662
1760378645.428904 eth0  Out IP c2e-hono-adapter-mqtt-5b5fcd88df-p284b.8883 > 10.42.0.1.52918: Flags [.], ack 56301, win 371, options [nop,nop,TS val 2764743709 ecr 2642339291], length 0
1760378645.529164 eth0  In  IP 10.42.0.1.52918 > c2e-hono-adapter-mqtt-5b5fcd88df-p284b.8883: Flags [P.], seq 56301:56963, ack 3044, win 501, options [nop,nop,TS val 2642339392 ecr 2764743709], length 662
1760378645.529239 eth0  Out IP c2e-hono-adapter-mqtt-5b5fcd88df-p284b.8883 > 10.42.0.1.52918: Flags [.], ack 56963, win 371, options [nop,nop,TS val 2764743809 ecr 2642339392], length 0
1760378645.626324 eth0  In  IP 10.42.0.1.52918 > c2e-hono-adapter-mqtt-5b5fcd88df-p284b.8883: Flags [P.], seq 56963:57625, ack 3044, win 501, options [nop,nop,TS val 2642339493 ecr 2764743809], length 662
1760378645.626388 eth0  Out IP c2e-hono-adapter-mqtt-5b5fcd88df-p284b.8883 > 10.42.0.1.52918: Flags [.], ack 57625, win 371, options [nop,nop,TS val 2764743907 ecr 2642339493], length 0
1760378645.726990 eth0  In  IP 10.42.0.1.52918 > c2e-hono-adapter-mqtt-5b5fcd88df-p284b.8883: Flags [P.], seq 57625:58287, ack 3044, win 501, options [nop,nop,TS val 2642339594 ecr 2764743907], length 662
1760378645.727068 eth0  Out IP c2e-hono-adapter-mqtt-5b5fcd88df-p284b.8883 > 10.42.0.1.52918: Flags [.], ack 58287, win 371, options [nop,nop,TS val 2764744007 ecr 2642339594], length 0
1760378645.838273 eth0  In  IP 10.42.0.1.52918 > c2e-hono-adapter-mqtt-5b5fcd88df-p284b.8883: Flags [P.], seq 58287:58949, ack 3044, win 501, options [nop,nop,TS val 2642339695 ecr 2764744007], length 662
1760378645.838342 eth0  Out IP c2e-hono-adapter-mqtt-5b5fcd88df-p284b.8883 > 10.42.0.1.52918: Flags [.], ack 58949, win 371, options [nop,nop,TS val 2764744119 ecr 2642339695], length 0
1760378645.933401 eth0  In  IP 10.42.0.1.52918 > c2e-hono-adapter-mqtt-5b5fcd88df-p284b.8883: Flags [P.], seq 58949:59611, ack 3044, win 501, options [nop,nop,TS val 2642339796 ecr 2764744119], length 662
1760378645.933457 eth0  Out IP c2e-hono-adapter-mqtt-5b5fcd88df-p284b.8883 > 10.42.0.1.52918: Flags [.], ack 59611, win 371, options [nop,nop,TS val 2764744214 ecr 2642339796], length 0
1760378646.033828 eth0  In  IP 10.42.0.1.52918 > c2e-hono-adapter-mqtt-5b5fcd88df-p284b.8883: Flags [P.], seq 59611:60273, ack 3044, win 501, options [nop,nop,TS val 2642339897 ecr 2764744214], length 662
1760378646.033933 eth0  Out IP c2e-hono-adapter-mqtt-5b5fcd88df-p284b.8883 > 10.42.0.1.52918: Flags [.], ack 60273, win 371, options [nop,nop,TS val 2764744314 ecr 2642339897], length 0
1760378646.130841 eth0  In  IP 10.42.0.1.52918 > c2e-hono-adapter-mqtt-5b5fcd88df-p284b.8883: Flags [P.], seq 60273:60935, ack 3044, win 501, options [nop,nop,TS val 2642339998 ecr 2764744314], length 662
1760378646.130895 eth0  Out IP c2e-hono-adapter-mqtt-5b5fcd88df-p284b.8883 > 10.42.0.1.52918: Flags [.], ack 60935, win 371, options [nop,nop,TS val 2764744411 ecr 2642339998], length 0
1760378646.233336 eth0  In  IP 10.42.0.1.52918 > c2e-hono-adapter-mqtt-5b5fcd88df-p284b.8883: Flags [P.], seq 60935:61597, ack 3044, win 501, options [nop,nop,TS val 2642340098 ecr 2764744411], length 662
1760378646.233487 eth0  Out IP c2e-hono-adapter-mqtt-5b5fcd88df-p284b.8883 > 10.42.0.1.52918: Flags [.], ack 61597, win 376, options [nop,nop,TS val 2764744514 ecr 2642340098], length 0
1760378646.335488 eth0  In  IP 10.42.0.1.52918 > c2e-hono-adapter-mqtt-5b5fcd88df-p284b.8883: Flags [P.], seq 61597:62259, ack 3044, win 501, options [nop,nop,TS val 2642340199 ecr 2764744514], length 662
1760378646.335679 eth0  Out IP c2e-hono-adapter-mqtt-5b5fcd88df-p284b.8883 > 10.42.0.1.52918: Flags [.], ack 62259, win 376, options [nop,nop,TS val 2764744616 ecr 2642340199], length 0
1760378646.438491 eth0  In  IP 10.42.0.1.52918 > c2e-hono-adapter-mqtt-5b5fcd88df-p284b.8883: Flags [P.], seq 62259:62921, ack 3044, win 501, options [nop,nop,TS val 2642340300 ecr 2764744616], length 662
1760378646.438693 eth0  Out IP c2e-hono-adapter-mqtt-5b5fcd88df-p284b.8883 > 10.42.0.1.52918: Flags [.], ack 62921, win 376, options [nop,nop,TS val 2764744719 ecr 2642340300], length 0
